id_venda,id_cliente,data_venda,valor_total
1,,2024-08-01 00:00:00,238.76
2,2704.0,01/08/2024 00:00:00,267.2
3,1036.0,2024-08-01 00:00:00,637.39
4,2832.0,2024-08-01 00:00:00,441.94
5,668.0,2024-08-01 00:00:00,81.79
6,1146.0,2024-08-01 00:00:00,41.68
7,90.0,2024-08-01 00:00:00,98.29
8,540.0,2024-08-01 00:00:00,16.18
9,41.0,2024-08-01 00:00:00,60.21
10,1947.0,2024-08-01 00:00:00,239.57
11,1225.0,2024-08-01 00:00:00,74.08
12,2509.0,2024-08-01 00:00:00,230.87
13,925.0,01/08/2024 00:00:00,28.59
14,390.0,01/08/2024 00:00:00,598.35
15,256.0,2024-08-01 00:00:00,174.05
16,1945.0,2024-08-01 00:00:00,108.34
17,2872.0,2024-08-02 00:00:00,418.56
18,877.0,2024-08-02 00:00:00,36.03
19,1016.0,2024-08-02 00:00:00,94.47
20,2194.0,2024-08-02 00:00:00,872.86
21,2225.0,2024-08-02 00:00:00,94.56
22,63.0,2024-08-02 00:00:00,99.84
23,2875.0,02/08/2024 00:00:00,369.18
24,1485.0,2024-08-02 00:00:00,13.12
25,2153.0,2024-08-02 00:00:00,107.17
26,385.0,2024-08-02 00:00:00,10.0
27,2871.0,2024-08-02 00:00:00,400.09
28,2001.0,2024-08-02 00:00:00,152.86
29,1669.0,2024-08-02 00:00:00,1138.97
30,1461.0,2024-08-02 00:00:00,175.97
31,2725.0,2024-08-02 00:00:00,283.01
32,83.0,2024-08-02 00:00:00,56.83
33,2505.0,2024-08-02 00:00:00,27.66
34,51.0,2024-08-02 00:00:00,64.24
35,1470.0,2024-08-02 00:00:00,421.11
36,488.0,2024-08-02 00:00:00,192.53
37,2143.0,2024-08-02 00:00:00,24.11
38,2202.0,2024-08-02 00:00:00,137.9
39,438.0,2024-08-02 00:00:00,295.96
40,268.0,2024-08-02 00:00:00,338.98
41,236.0,2024-08-02 00:00:00,164.62
42,763.0,2024-08-02 00:00:00,103.33
43,624.0,2024-08-02 00:00:00,130.8
44,2967.0,2024-08-03 00:00:00,281.41
45,2901.0,2024-08-03 00:00:00,203.98
46,2123.0,2024-08-03 00:00:00,47.9
47,764.0,03/08/2024 00:00:00,787.09
48,1330.0,2024-08-03 00:00:00,178.28
49,2846.0,2024-08-03 00:00:00,161.85
50,2483.0,2024-08-03 00:00:00,469.01
51,1332.0,2024-08-03 00:00:00,158.57
52,1359.0,2024-08-03 00:00:00,101.02
53,759.0,2024-08-03 00:00:00,148.3
54,2129.0,2024-08-03 00:00:00,597.24
55,2948.0,2024-08-03 00:00:00,123.0
56,1354.0,2024-08-03 00:00:00,293.0
57,1876.0,2024-08-03 00:00:00,122.92
58,2594.0,2024-08-03 00:00:00,193.94
59,1474.0,2024-08-03 00:00:00,79.72
60,43.0,2024-08-03 00:00:00,54.93
61,1907.0,2024-08-04 00:00:00,154.12
62,2896.0,2024-08-04 00:00:00,32.95
63,1936.0,2024-08-04 00:00:00,204.82
64,360.0,2024-08-04 00:00:00,238.48
65,281.0,2024-08-04 00:00:00,454.19
66,667.0,2024-08-04 00:00:00,220.26
67,1970.0,2024-08-04 00:00:00,184.23
68,1029.0,2024-08-04 00:00:00,84.65
69,682.0,2024-08-04 00:00:00,38.96
70,1429.0,2024-08-04 00:00:00,159.13
71,2693.0,2024-08-04 00:00:00,123.53
72,2394.0,04/08/2024 00:00:00,449.27
73,1969.0,2024-08-04 00:00:00,140.0
74,1837.0,2024-08-04 00:00:00,77.6
75,2842.0,2024-08-04 00:00:00,321.3
76,1145.0,2024-08-04 00:00:00,232.81
77,1080.0,2024-08-04 00:00:00,413.63
78,2879.0,2024-08-04 00:00:00,94.73
79,337.0,2024-08-04 00:00:00,64.84
80,1281.0,2024-08-04 00:00:00,17.66
81,1891.0,04/08/2024 00:00:00,40.8
82,2767.0,2024-08-04 00:00:00,153.83
83,56.0,2024-08-04 00:00:00,132.53
84,474.0,2024-08-04 00:00:00,285.39
85,2126.0,2024-08-04 00:00:00,124.18
86,365.0,2024-08-04 00:00:00,12.87
87,2747.0,2024-08-04 00:00:00,58.19
88,1031.0,04/08/2024 00:00:00,232.42
89,919.0,2024-08-04 00:00:00,143.36
90,1775.0,2024-08-05 00:00:00,10.0
91,2854.0,2024-08-05 00:00:00,152.12
92,1216.0,2024-08-05 00:00:00,62.73
93,485.0,2024-08-05 00:00:00,40.25
94,1063.0,2024-08-05 00:00:00,77.74
95,1255.0,2024-08-05 00:00:00,18.69
96,126.0,2024-08-05 00:00:00,25.51
97,2193.0,2024-08-05 00:00:00,83.99
98,2073.0,2024-08-05 00:00:00,227.33
99,67.0,2024-08-05 00:00:00,209.29
100,1170.0,2024-08-05 00:00:00,18.19
101,111.0,2024-08-05 00:00:00,266.99
102,623.0,2024-08-05 00:00:00,273.64
103,2796.0,2024-08-05 00:00:00,27.3
104,2473.0,2024-08-05 00:00:00,82.33
105,2740.0,2024-08-05 00:00:00,207.64
106,1762.0,2024-08-05 00:00:00,56.04
107,2363.0,2024-08-05 00:00:00,861.24
108,1313.0,2024-08-05 00:00:00,10.0
109,2325.0,2024-08-05 00:00:00,33.18
110,1527.0,2024-08-06 00:00:00,133.81
111,2891.0,2024-08-06 00:00:00,18.4
112,2398.0,2024-08-06 00:00:00,38.08
113,2871.0,2024-08-06 00:00:00,369.43
114,2947.0,2024-08-06 00:00:00,148.68
115,1064.0,2024-08-06 00:00:00,238.78
116,920.0,2024-08-06 00:00:00,23.77
117,468.0,2024-08-06 00:00:00,697.81
118,4.0,06/08/2024 00:00:00,10.0
119,118.0,2024-08-06 00:00:00,59.66
120,2552.0,2024-08-06 00:00:00,256.67
121,2622.0,2024-08-06 00:00:00,530.08
122,847.0,2024-08-06 00:00:00,153.16
123,1459.0,2024-08-06 00:00:00,364.75
124,1669.0,2024-08-06 00:00:00,41.42
125,1142.0,2024-08-06 00:00:00,248.23
126,724.0,2024-08-06 00:00:00,141.7
127,113.0,2024-08-06 00:00:00,150.94
128,2049.0,2024-08-06 00:00:00,188.64
129,320.0,2024-08-06 00:00:00,18.27
130,1918.0,2024-08-06 00:00:00,33.53
131,2893.0,2024-08-06 00:00:00,152.11
132,902.0,2024-08-06 00:00:00,82.08
133,10.0,2024-08-06 00:00:00,159.08
134,1674.0,2024-08-06 00:00:00,920.24
135,2061.0,2024-08-06 00:00:00,230.76
136,1620.0,2024-08-06 00:00:00,58.78
137,1637.0,2024-08-07 00:00:00,10.0
138,2825.0,2024-08-07 00:00:00,181.09
139,1944.0,2024-08-07 00:00:00,186.33
140,1119.0,2024-08-07 00:00:00,530.51
141,2366.0,07/08/2024 00:00:00,274.06
142,1970.0,2024-08-07 00:00:00,26.55
143,376.0,2024-08-07 00:00:00,940.55
144,2636.0,2024-08-07 00:00:00,95.36
145,2561.0,2024-08-07 00:00:00,270.28
146,2966.0,2024-08-07 00:00:00,10.0
147,1373.0,2024-08-07 00:00:00,30.11
148,873.0,2024-08-07 00:00:00,277.66
149,1852.0,2024-08-07 00:00:00,35.74
150,725.0,2024-08-07 00:00:00,41.26
151,2899.0,2024-08-07 00:00:00,218.84
152,2622.0,08/08/2024 00:00:00,88.89
153,1773.0,2024-08-08 00:00:00,177.5
154,2450.0,2024-08-08 00:00:00,339.22
155,1319.0,2024-08-08 00:00:00,250.2
156,2848.0,2024-08-08 00:00:00,124.23
157,2470.0,2024-08-08 00:00:00,155.21
158,575.0,2024-08-08 00:00:00,139.72
159,2713.0,2024-08-08 00:00:00,87.81
160,503.0,2024-08-08 00:00:00,151.8
161,821.0,2024-08-08 00:00:00,473.9
162,1971.0,2024-08-08 00:00:00,112.96
163,2627.0,2024-08-08 00:00:00,197.62
164,2602.0,2024-08-08 00:00:00,30.0
165,1647.0,2024-08-08 00:00:00,193.56
166,2036.0,2024-08-08 00:00:00,270.54
167,923.0,2024-08-08 00:00:00,310.8
168,2598.0,2024-08-08 00:00:00,279.19
169,951.0,2024-08-09 00:00:00,30.89
170,2244.0,2024-08-09 00:00:00,168.74
171,517.0,2024-08-09 00:00:00,418.73
172,2913.0,2024-08-09 00:00:00,21.72
173,1933.0,2024-08-09 00:00:00,23.45
174,2276.0,2024-08-09 00:00:00,122.13
175,2996.0,2024-08-09 00:00:00,101.26
176,2095.0,2024-08-09 00:00:00,105.17
177,130.0,2024-08-09 00:00:00,10.0
178,2675.0,2024-08-09 00:00:00,236.8
179,794.0,2024-08-09 00:00:00,58.02
180,2117.0,2024-08-09 00:00:00,350.66
181,1866.0,2024-08-09 00:00:00,83.87
182,712.0,2024-08-09 00:00:00,110.19
183,346.0,2024-08-09 00:00:00,588.56
184,2444.0,2024-08-09 00:00:00,485.75
185,985.0,2024-08-10 00:00:00,59.15
186,1640.0,2024-08-10 00:00:00,411.34
187,356.0,2024-08-10 00:00:00,502.05
188,2936.0,2024-08-10 00:00:00,10.0
189,127.0,2024-08-10 00:00:00,33.1
190,604.0,2024-08-10 00:00:00,93.82
191,1929.0,2024-08-10 00:00:00,110.37
192,2827.0,2024-08-10 00:00:00,119.87
193,2862.0,2024-08-10 00:00:00,53.81
194,1646.0,2024-08-10 00:00:00,41.24
195,2873.0,2024-08-10 00:00:00,80.74
196,567.0,2024-08-10 00:00:00,51.6
197,1935.0,2024-08-10 00:00:00,101.83
198,1333.0,2024-08-10 00:00:00,81.65
199,2361.0,2024-08-10 00:00:00,10.0
200,937.0,11/08/2024 00:00:00,24.27
201,2292.0,2024-08-11 00:00:00,154.18
202,2123.0,2024-08-11 00:00:00,512.69
203,475.0,2024-08-11 00:00:00,267.5
204,2688.0,2024-08-11 00:00:00,50.88
205,876.0,2024-08-11 00:00:00,487.79
206,1206.0,2024-08-11 00:00:00,38.81
207,1991.0,2024-08-11 00:00:00,36.19
208,1880.0,2024-08-11 00:00:00,74.64
209,285.0,2024-08-11 00:00:00,173.78
210,662.0,11/08/2024 00:00:00,49.72
211,1493.0,2024-08-11 00:00:00,144.79
212,849.0,2024-08-11 00:00:00,649.2
213,689.0,2024-08-11 00:00:00,162.98
214,342.0,2024-08-11 00:00:00,17.84
215,1725.0,2024-08-11 00:00:00,40.78
216,327.0,2024-08-11 00:00:00,180.96
217,990.0,2024-08-11 00:00:00,277.23
218,952.0,2024-08-11 00:00:00,456.66
219,2080.0,2024-08-11 00:00:00,126.31
220,429.0,2024-08-12 00:00:00,94.87
221,2066.0,2024-08-12 00:00:00,69.64
222,1395.0,2024-08-12 00:00:00,120.77
223,194.0,2024-08-12 00:00:00,152.91
224,1137.0,2024-08-12 00:00:00,102.42
225,1702.0,2024-08-12 00:00:00,289.94
226,1921.0,2024-08-12 00:00:00,81.4
227,55.0,2024-08-12 00:00:00,584.18
228,800.0,2024-08-12 00:00:00,63.57
229,1902.0,2024-08-12 00:00:00,149.55
230,2135.0,2024-08-12 00:00:00,771.99
231,1824.0,2024-08-12 00:00:00,251.74
232,833.0,2024-08-12 00:00:00,160.47
233,1859.0,2024-08-12 00:00:00,52.55
234,2491.0,2024-08-12 00:00:00,140.84
235,328.0,2024-08-12 00:00:00,21.99
236,2627.0,2024-08-13 00:00:00,436.89
237,1288.0,2024-08-13 00:00:00,20.95
238,2144.0,2024-08-13 00:00:00,897.1
239,1312.0,2024-08-13 00:00:00,387.17
240,2539.0,2024-08-13 00:00:00,657.48
241,1524.0,2024-08-13 00:00:00,220.58
242,2517.0,2024-08-13 00:00:00,104.31
243,823.0,2024-08-13 00:00:00,453.32
244,2055.0,2024-08-13 00:00:00,200.61
245,2199.0,2024-08-13 00:00:00,376.94
246,915.0,2024-08-13 00:00:00,174.95
247,2748.0,2024-08-13 00:00:00,243.44
248,1921.0,2024-08-13 00:00:00,340.14
249,1940.0,2024-08-13 00:00:00,81.85
250,1410.0,2024-08-13 00:00:00,90.22
251,396.0,2024-08-13 00:00:00,355.16
252,805.0,2024-08-13 00:00:00,105.33
253,1758.0,2024-08-13 00:00:00,90.12
254,1077.0,2024-08-13 00:00:00,69.76
255,1524.0,2024-08-13 00:00:00,734.19
256,1388.0,2024-08-13 00:00:00,30.19
257,2762.0,2024-08-13 00:00:00,166.84
258,2107.0,2024-08-13 00:00:00,449.91
259,128.0,2024-08-13 00:00:00,40.2
260,2574.0,2024-08-13 00:00:00,270.72
261,237.0,2024-08-13 00:00:00,103.02
262,1782.0,2024-08-13 00:00:00,207.16
263,2542.0,2024-08-13 00:00:00,832.12
264,442.0,2024-08-14 00:00:00,461.66
265,2658.0,14/08/2024 00:00:00,63.58
266,75.0,2024-08-14 00:00:00,345.85
267,2176.0,2024-08-14 00:00:00,25.06
268,1380.0,2024-08-14 00:00:00,137.87
269,2082.0,2024-08-14 00:00:00,161.57
270,1402.0,2024-08-14 00:00:00,254.74
271,342.0,2024-08-14 00:00:00,29.44
272,646.0,2024-08-14 00:00:00,263.49
273,610.0,2024-08-14 00:00:00,183.52
274,2041.0,2024-08-14 00:00:00,136.35
275,2954.0,2024-08-14 00:00:00,491.64
276,2970.0,2024-08-14 00:00:00,103.63
277,702.0,2024-08-14 00:00:00,146.34
278,1600.0,2024-08-14 00:00:00,87.35
279,1846.0,2024-08-14 00:00:00,267.91
280,2867.0,2024-08-14 00:00:00,18.94
281,1395.0,2024-08-14 00:00:00,56.3
282,149.0,2024-08-14 00:00:00,362.9
283,2059.0,2024-08-14 00:00:00,87.91
284,1137.0,2024-08-14 00:00:00,255.69
285,2792.0,2024-08-14 00:00:00,167.13
286,98.0,2024-08-14 00:00:00,101.05
287,2712.0,14/08/2024 00:00:00,552.38
288,2117.0,2024-08-14 00:00:00,132.23
289,1786.0,2024-08-14 00:00:00,10.0
290,1763.0,15/08/2024 00:00:00,368.44
291,365.0,2024-08-15 00:00:00,33.61
292,2249.0,2024-08-15 00:00:00,294.73
293,1525.0,2024-08-15 00:00:00,84.44
294,2344.0,2024-08-15 00:00:00,260.53
295,1241.0,2024-08-15 00:00:00,244.11
296,1640.0,2024-08-15 00:00:00,114.12
297,1063.0,2024-08-15 00:00:00,15.79
298,1253.0,2024-08-15 00:00:00,10.0
299,1459.0,2024-08-15 00:00:00,63.53
300,2914.0,2024-08-15 00:00:00,21.76
301,1637.0,2024-08-15 00:00:00,19.21
302,2865.0,2024-08-15 00:00:00,29.43
303,330.0,2024-08-15 00:00:00,234.6
304,1521.0,2024-08-15 00:00:00,40.95
305,1342.0,2024-08-15 00:00:00,634.83
306,339.0,2024-08-15 00:00:00,263.52
307,2709.0,2024-08-15 00:00:00,284.62
308,1509.0,2024-08-15 00:00:00,235.71
309,710.0,2024-08-15 00:00:00,788.26
310,2514.0,2024-08-15 00:00:00,134.44
311,489.0,2024-08-15 00:00:00,576.69
312,47.0,2024-08-15 00:00:00,10.0
313,1040.0,2024-08-15 00:00:00,518.72
314,1818.0,2024-08-15 00:00:00,167.84
315,250.0,2024-08-15 00:00:00,75.04
316,335.0,2024-08-15 00:00:00,239.08
317,137.0,2024-08-15 00:00:00,42.79
318,1522.0,2024-08-15 00:00:00,109.55
319,1501.0,2024-08-15 00:00:00,128.57
320,990.0,2024-08-16 00:00:00,11.29
321,402.0,2024-08-16 00:00:00,147.81
322,615.0,2024-08-16 00:00:00,10.0
323,1183.0,2024-08-16 00:00:00,90.73
324,2668.0,2024-08-16 00:00:00,25.7
325,1122.0,2024-08-16 00:00:00,432.56
326,1195.0,2024-08-16 00:00:00,83.07
327,183.0,2024-08-16 00:00:00,103.67
328,39.0,2024-08-16 00:00:00,75.75
329,2545.0,2024-08-16 00:00:00,154.61
330,921.0,2024-08-16 00:00:00,267.77
331,16.0,2024-08-16 00:00:00,111.31
332,1132.0,2024-08-16 00:00:00,53.04
333,311.0,2024-08-16 00:00:00,123.96
334,546.0,2024-08-16 00:00:00,10.0
335,759.0,2024-08-16 00:00:00,41.03
336,1298.0,2024-08-16 00:00:00,559.6
337,1915.0,2024-08-16 00:00:00,1236.44
338,29.0,2024-08-16 00:00:00,291.51
339,477.0,2024-08-16 00:00:00,10.0
340,748.0,2024-08-16 00:00:00,197.51
341,1772.0,2024-08-16 00:00:00,828.08
342,266.0,2024-08-16 00:00:00,19.24
343,340.0,2024-08-16 00:00:00,267.56
344,2051.0,16/08/2024 00:00:00,125.96
345,376.0,2024-08-16 00:00:00,67.72
346,2372.0,2024-08-16 00:00:00,251.44
347,293.0,2024-08-16 00:00:00,10.0
348,705.0,2024-08-17 00:00:00,482.34
349,1999.0,2024-08-17 00:00:00,111.64
350,2865.0,2024-08-17 00:00:00,99.39
351,964.0,2024-08-17 00:00:00,49.25
352,2042.0,2024-08-17 00:00:00,319.89
353,939.0,2024-08-17 00:00:00,177.62
354,807.0,2024-08-17 00:00:00,422.59
355,1326.0,2024-08-17 00:00:00,183.66
356,1086.0,2024-08-17 00:00:00,190.08
357,2612.0,2024-08-17 00:00:00,13.44
358,1608.0,2024-08-17 00:00:00,572.0
359,1334.0,2024-08-17 00:00:00,187.16
360,1390.0,2024-08-17 00:00:00,52.45
361,226.0,2024-08-17 00:00:00,96.93
362,937.0,2024-08-17 00:00:00,41.27
363,2307.0,2024-08-17 00:00:00,349.98
364,1797.0,2024-08-17 00:00:00,198.73
365,727.0,2024-08-17 00:00:00,430.46
366,1044.0,2024-08-18 00:00:00,1056.01
367,1597.0,2024-08-18 00:00:00,60.28
368,2467.0,2024-08-18 00:00:00,283.96
369,2110.0,2024-08-18 00:00:00,1121.83
370,3.0,2024-08-18 00:00:00,338.38
371,781.0,2024-08-18 00:00:00,50.67
372,2031.0,2024-08-18 00:00:00,10.0
373,580.0,2024-08-18 00:00:00,173.54
374,1291.0,2024-08-18 00:00:00,419.86
375,2683.0,2024-08-18 00:00:00,27.74
376,1219.0,2024-08-18 00:00:00,623.14
377,1356.0,2024-08-18 00:00:00,10.0
378,1487.0,2024-08-18 00:00:00,212.98
379,1419.0,2024-08-18 00:00:00,18.2
380,984.0,2024-08-18 00:00:00,58.24
381,38.0,2024-08-18 00:00:00,60.15
382,1200.0,2024-08-18 00:00:00,136.99
383,454.0,2024-08-18 00:00:00,654.68
384,1712.0,2024-08-19 00:00:00,229.93
385,973.0,2024-08-19 00:00:00,381.04
386,1325.0,2024-08-19 00:00:00,131.01
387,2397.0,2024-08-19 00:00:00,473.99
388,1347.0,2024-08-19 00:00:00,85.48
389,1890.0,2024-08-19 00:00:00,156.96
390,1997.0,2024-08-19 00:00:00,62.13
391,1286.0,2024-08-19 00:00:00,147.32
392,2384.0,2024-08-19 00:00:00,214.85
393,2401.0,2024-08-19 00:00:00,34.24
394,2864.0,2024-08-19 00:00:00,246.45
395,363.0,2024-08-19 00:00:00,54.54
396,1717.0,2024-08-19 00:00:00,227.97
397,191.0,2024-08-19 00:00:00,240.12
398,700.0,2024-08-19 00:00:00,34.54
399,557.0,2024-08-19 00:00:00,410.9
400,1055.0,2024-08-19 00:00:00,349.53
401,2720.0,2024-08-19 00:00:00,81.63
402,1575.0,2024-08-19 00:00:00,35.05
403,2404.0,2024-08-19 00:00:00,162.47
404,589.0,2024-08-19 00:00:00,141.64
405,295.0,2024-08-19 00:00:00,42.92
406,1549.0,2024-08-19 00:00:00,191.91
407,1137.0,2024-08-19 00:00:00,164.13
408,360.0,2024-08-19 00:00:00,60.17
409,700.0,2024-08-19 00:00:00,10.0
410,2413.0,2024-08-19 00:00:00,302.69
411,1350.0,2024-08-19 00:00:00,66.63
412,586.0,2024-08-20 00:00:00,113.21
413,994.0,2024-08-20 00:00:00,83.67
414,572.0,20/08/2024 00:00:00,39.57
415,2085.0,2024-08-20 00:00:00,21.63
416,1220.0,2024-08-20 00:00:00,38.17
417,484.0,2024-08-20 00:00:00,14.05
418,731.0,2024-08-20 00:00:00,36.39
419,2572.0,2024-08-20 00:00:00,13.95
420,886.0,2024-08-20 00:00:00,84.89
421,474.0,2024-08-20 00:00:00,15.53
422,2258.0,2024-08-20 00:00:00,410.42
423,704.0,2024-08-20 00:00:00,225.43
424,716.0,2024-08-20 00:00:00,276.98
425,1251.0,2024-08-20 00:00:00,180.48
426,2508.0,2024-08-20 00:00:00,10.0
427,907.0,2024-08-20 00:00:00,344.65
428,2927.0,2024-08-20 00:00:00,134.14
429,2995.0,2024-08-21 00:00:00,58.21
430,2007.0,2024-08-21 00:00:00,118.08
431,1454.0,2024-08-21 00:00:00,126.43
432,516.0,2024-08-21 00:00:00,111.09
433,2445.0,2024-08-21 00:00:00,385.12
434,887.0,21/08/2024 00:00:00,349.65
435,1099.0,2024-08-21 00:00:00,49.89
436,1711.0,2024-08-21 00:00:00,228.2
437,1563.0,2024-08-21 00:00:00,405.07
438,2796.0,2024-08-21 00:00:00,10.0
439,989.0,2024-08-21 00:00:00,575.11
440,869.0,2024-08-21 00:00:00,203.51
441,1683.0,2024-08-21 00:00:00,64.1
442,1411.0,2024-08-21 00:00:00,74.78
443,570.0,2024-08-21 00:00:00,449.05
444,1981.0,2024-08-21 00:00:00,44.72
445,793.0,2024-08-21 00:00:00,251.0
446,1810.0,2024-08-21 00:00:00,399.55
447,2256.0,2024-08-21 00:00:00,156.72
448,1084.0,2024-08-21 00:00:00,41.04
449,1681.0,2024-08-21 00:00:00,19.12
450,520.0,2024-08-21 00:00:00,294.74
451,1710.0,21/08/2024 00:00:00,151.16
452,2247.0,2024-08-21 00:00:00,196.82
453,960.0,2024-08-21 00:00:00,69.68
454,1560.0,2024-08-21 00:00:00,507.28
455,2947.0,2024-08-21 00:00:00,41.03
456,527.0,2024-08-21 00:00:00,131.37
457,2254.0,2024-08-21 00:00:00,182.42
458,1260.0,2024-08-21 00:00:00,56.88
459,521.0,2024-08-22 00:00:00,44.76
460,1017.0,2024-08-22 00:00:00,35.07
461,2774.0,2024-08-22 00:00:00,174.44
462,117.0,2024-08-22 00:00:00,178.45
463,584.0,22/08/2024 00:00:00,74.32
464,2769.0,2024-08-22 00:00:00,10.0
465,274.0,2024-08-22 00:00:00,228.17
466,338.0,2024-08-22 00:00:00,130.76
467,607.0,2024-08-22 00:00:00,255.95
468,2059.0,2024-08-22 00:00:00,237.48
469,2849.0,2024-08-22 00:00:00,610.03
470,,2024-08-22 00:00:00,257.68
471,1112.0,2024-08-22 00:00:00,31.55
472,2636.0,2024-08-22 00:00:00,863.44
473,1696.0,2024-08-22 00:00:00,10.0
474,1334.0,2024-08-22 00:00:00,192.55
475,2721.0,2024-08-22 00:00:00,164.04
476,1952.0,2024-08-22 00:00:00,566.85
477,2.0,2024-08-22 00:00:00,152.82
478,1769.0,2024-08-22 00:00:00,86.35
479,2637.0,2024-08-22 00:00:00,16.37
480,918.0,2024-08-23 00:00:00,77.75
481,2919.0,2024-08-23 00:00:00,44.84
482,2170.0,2024-08-23 00:00:00,322.48
483,106.0,2024-08-23 00:00:00,36.66
484,1329.0,2024-08-23 00:00:00,605.44
485,317.0,2024-08-23 00:00:00,245.16
486,1926.0,2024-08-23 00:00:00,180.66
487,2271.0,2024-08-23 00:00:00,155.87
488,716.0,2024-08-23 00:00:00,409.54
489,1714.0,2024-08-23 00:00:00,196.33
490,1108.0,2024-08-23 00:00:00,82.94
491,251.0,2024-08-23 00:00:00,132.48
492,459.0,2024-08-23 00:00:00,450.41
493,900.0,2024-08-23 00:00:00,182.0
494,22.0,2024-08-23 00:00:00,120.41
495,515.0,2024-08-23 00:00:00,10.0
496,874.0,2024-08-23 00:00:00,115.47
497,2135.0,2024-08-23 00:00:00,210.13
498,1561.0,2024-08-23 00:00:00,410.81
499,2170.0,2024-08-23 00:00:00,79.8
500,750.0,2024-08-23 00:00:00,82.16
501,1928.0,2024-08-24 00:00:00,410.88
502,2357.0,2024-08-24 00:00:00,215.0
503,307.0,2024-08-24 00:00:00,35.27
504,1990.0,2024-08-24 00:00:00,254.02
505,662.0,2024-08-24 00:00:00,80.79
506,312.0,2024-08-24 00:00:00,736.13
507,2972.0,2024-08-24 00:00:00,44.51
508,35.0,2024-08-24 00:00:00,49.84
509,1983.0,2024-08-24 00:00:00,45.53
510,903.0,2024-08-24 00:00:00,124.21
511,2910.0,2024-08-24 00:00:00,647.72
512,1978.0,2024-08-24 00:00:00,271.51
513,404.0,2024-08-24 00:00:00,198.18
514,2780.0,2024-08-24 00:00:00,92.74
515,2580.0,2024-08-24 00:00:00,140.58
516,1713.0,2024-08-24 00:00:00,144.31
517,2468.0,2024-08-24 00:00:00,10.0
518,2914.0,2024-08-24 00:00:00,133.37
519,2626.0,2024-08-24 00:00:00,182.12
520,2980.0,2024-08-24 00:00:00,109.54
521,755.0,2024-08-24 00:00:00,179.47
522,1270.0,2024-08-24 00:00:00,88.99
523,530.0,2024-08-24 00:00:00,199.7
524,2959.0,2024-08-25 00:00:00,53.78
525,794.0,2024-08-25 00:00:00,251.63
526,2800.0,2024-08-25 00:00:00,184.19
527,940.0,2024-08-25 00:00:00,93.31
528,2.0,2024-08-25 00:00:00,39.93
529,2885.0,2024-08-25 00:00:00,14.33
530,553.0,2024-08-25 00:00:00,56.8
531,1852.0,2024-08-25 00:00:00,103.85
532,14.0,2024-08-25 00:00:00,144.65
533,2009.0,2024-08-25 00:00:00,217.31
534,838.0,2024-08-25 00:00:00,211.18
535,2041.0,25/08/2024 00:00:00,101.85
536,1253.0,2024-08-25 00:00:00,10.0
537,1473.0,2024-08-25 00:00:00,296.98
538,301.0,2024-08-25 00:00:00,54.11
539,2335.0,2024-08-25 00:00:00,53.85
540,630.0,2024-08-25 00:00:00,37.21
541,1994.0,2024-08-25 00:00:00,119.12
542,2892.0,2024-08-26 00:00:00,353.08
543,1281.0,2024-08-26 00:00:00,119.36
544,1800.0,2024-08-26 00:00:00,192.02
545,2561.0,2024-08-26 00:00:00,58.21
546,2934.0,2024-08-26 00:00:00,36.69
547,1957.0,26/08/2024 00:00:00,88.24
548,2213.0,2024-08-26 00:00:00,304.46
549,1656.0,2024-08-26 00:00:00,327.64
550,2204.0,2024-08-26 00:00:00,399.34
551,1926.0,2024-08-26 00:00:00,46.09
552,957.0,2024-08-26 00:00:00,10.0
553,2382.0,2024-08-26 00:00:00,11.76
554,2559.0,2024-08-26 00:00:00,52.57
555,282.0,2024-08-26 00:00:00,10.0
556,2167.0,2024-08-26 00:00:00,50.9
557,2533.0,2024-08-26 00:00:00,543.24
558,2885.0,2024-08-27 00:00:00,21.81
559,2739.0,2024-08-27 00:00:00,10.0
560,490.0,2024-08-27 00:00:00,101.29
561,2290.0,2024-08-27 00:00:00,671.16
562,126.0,2024-08-27 00:00:00,606.53
563,1209.0,2024-08-27 00:00:00,173.55
564,2543.0,2024-08-27 00:00:00,147.52
565,919.0,2024-08-27 00:00:00,219.84
566,2199.0,2024-08-27 00:00:00,10.0
567,308.0,2024-08-27 00:00:00,243.94
568,2794.0,2024-08-27 00:00:00,264.03
569,2034.0,2024-08-27 00:00:00,41.74
570,1015.0,2024-08-27 00:00:00,223.32
571,1382.0,2024-08-27 00:00:00,405.21
572,86.0,2024-08-27 00:00:00,58.96
573,2359.0,2024-08-27 00:00:00,769.17
574,2475.0,2024-08-27 00:00:00,229.93
575,2162.0,2024-08-27 00:00:00,55.98
576,303.0,2024-08-27 00:00:00,169.08
577,588.0,2024-08-27 00:00:00,24.01
578,345.0,2024-08-27 00:00:00,233.93
579,2849.0,2024-08-27 00:00:00,183.56
580,1311.0,2024-08-27 00:00:00,215.11
581,1328.0,2024-08-27 00:00:00,210.67
582,1010.0,2024-08-27 00:00:00,185.75
583,575.0,2024-08-27 00:00:00,755.97
584,1113.0,2024-08-27 00:00:00,409.21
585,2633.0,2024-08-28 00:00:00,18.97
586,489.0,2024-08-28 00:00:00,23.11
587,494.0,2024-08-28 00:00:00,519.86
588,19.0,2024-08-28 00:00:00,329.89
589,2445.0,2024-08-28 00:00:00,319.71
590,851.0,2024-08-28 00:00:00,406.36
591,1368.0,2024-08-28 00:00:00,70.44
592,455.0,2024-08-28 00:00:00,10.0
593,711.0,2024-08-28 00:00:00,165.77
594,2876.0,2024-08-28 00:00:00,159.04
595,1441.0,2024-08-28 00:00:00,54.24
596,2339.0,2024-08-28 00:00:00,51.57
597,2010.0,2024-08-28 00:00:00,176.89
598,2890.0,2024-08-28 00:00:00,284.88
599,1027.0,2024-08-28 00:00:00,156.34
600,2376.0,2024-08-28 00:00:00,146.41
601,2502.0,2024-08-28 00:00:00,491.23
602,1178.0,2024-08-29 00:00:00,23.06
603,1157.0,2024-08-29 00:00:00,101.77
604,1764.0,2024-08-29 00:00:00,187.25
605,944.0,2024-08-29 00:00:00,159.44
606,2546.0,2024-08-29 00:00:00,251.4
607,2475.0,2024-08-29 00:00:00,10.0
608,407.0,2024-08-29 00:00:00,112.73
609,336.0,2024-08-29 00:00:00,208.53
610,1148.0,2024-08-29 00:00:00,618.71
611,1828.0,2024-08-29 00:00:00,523.55
612,324.0,2024-08-29 00:00:00,544.95
613,470.0,2024-08-29 00:00:00,43.27
614,1358.0,2024-08-29 00:00:00,133.06
615,373.0,2024-08-29 00:00:00,67.06
616,1693.0,2024-08-29 00:00:00,324.94
617,2339.0,2024-08-29 00:00:00,173.94
618,106.0,2024-08-29 00:00:00,188.49
619,1682.0,2024-08-29 00:00:00,102.13
620,2637.0,2024-08-29 00:00:00,106.73
621,350.0,2024-08-30 00:00:00,39.97
622,1063.0,2024-08-30 00:00:00,148.96
623,2360.0,2024-08-30 00:00:00,315.4
624,445.0,2024-08-30 00:00:00,59.29
625,36.0,2024-08-30 00:00:00,110.51
626,1799.0,2024-08-30 00:00:00,338.29
627,1196.0,2024-08-30 00:00:00,10.0
628,1386.0,2024-08-30 00:00:00,23.83
629,2189.0,2024-08-30 00:00:00,184.07
630,1301.0,2024-08-30 00:00:00,431.19
631,521.0,2024-08-30 00:00:00,208.03
632,984.0,2024-08-30 00:00:00,105.88
633,1661.0,2024-08-30 00:00:00,472.66
634,2200.0,2024-08-30 00:00:00,87.21
635,859.0,2024-08-30 00:00:00,303.3
636,50.0,2024-08-30 00:00:00,263.32
637,2905.0,2024-08-30 00:00:00,20.08
638,1463.0,2024-08-30 00:00:00,176.67
639,2735.0,2024-08-30 00:00:00,53.64
640,1250.0,2024-08-31 00:00:00,128.07
641,2709.0,2024-08-31 00:00:00,20.12
642,2853.0,2024-08-31 00:00:00,205.43
643,988.0,2024-08-31 00:00:00,46.18
644,1547.0,2024-08-31 00:00:00,52.78
645,2638.0,2024-08-31 00:00:00,199.94
646,441.0,2024-08-31 00:00:00,137.34
647,770.0,2024-08-31 00:00:00,64.19
648,263.0,2024-08-31 00:00:00,237.58
649,1578.0,2024-08-31 00:00:00,111.79
650,2507.0,2024-08-31 00:00:00,947.88
651,700.0,2024-08-31 00:00:00,341.53
652,1604.0,2024-08-31 00:00:00,257.72
653,2602.0,2024-08-31 00:00:00,471.88
654,2669.0,2024-08-31 00:00:00,16.55
655,744.0,2024-08-31 00:00:00,207.29
656,1923.0,2024-08-31 00:00:00,102.56
657,1377.0,2024-08-31 00:00:00,51.41
658,2473.0,2024-08-31 00:00:00,192.03
659,1805.0,2024-08-31 00:00:00,146.4
660,956.0,31/08/2024 00:00:00,322.24
661,160.0,2024-08-31 00:00:00,155.31
662,1736.0,2024-08-31 00:00:00,210.47
663,2429.0,2024-09-01 00:00:00,122.08
664,342.0,2024-09-01 00:00:00,221.42
665,2775.0,2024-09-01 00:00:00,95.12
666,2662.0,2024-09-01 00:00:00,163.19
667,2402.0,2024-09-01 00:00:00,118.25
668,116.0,2024-09-01 00:00:00,12.41
669,1466.0,2024-09-01 00:00:00,632.24
670,1869.0,01/09/2024 00:00:00,201.55
671,1017.0,2024-09-01 00:00:00,37.38
672,2666.0,2024-09-01 00:00:00,20.33
673,633.0,2024-09-01 00:00:00,344.98
674,657.0,2024-09-01 00:00:00,71.58
675,2563.0,2024-09-01 00:00:00,523.95
676,237.0,2024-09-01 00:00:00,25.53
677,2675.0,2024-09-01 00:00:00,33.07
678,1541.0,2024-09-01 00:00:00,267.26
679,1272.0,2024-09-01 00:00:00,155.29
680,286.0,2024-09-01 00:00:00,147.19
681,2454.0,01/09/2024 00:00:00,18.67
682,1767.0,01/09/2024 00:00:00,400.03
683,1013.0,2024-09-01 00:00:00,349.82
684,1524.0,2024-09-01 00:00:00,246.71
685,481.0,2024-09-01 00:00:00,51.59
686,2797.0,2024-09-01 00:00:00,89.3
687,341.0,2024-09-01 00:00:00,85.03
688,2809.0,2024-09-01 00:00:00,161.4
689,1867.0,2024-09-01 00:00:00,348.92
690,1726.0,2024-09-01 00:00:00,118.55
691,311.0,2024-09-01 00:00:00,35.29
692,406.0,2024-09-02 00:00:00,137.42
693,342.0,02/09/2024 00:00:00,167.21
694,244.0,2024-09-02 00:00:00,46.77
695,561.0,2024-09-02 00:00:00,24.74
696,594.0,2024-09-02 00:00:00,197.75
697,1694.0,2024-09-02 00:00:00,255.61
698,948.0,2024-09-02 00:00:00,341.56
699,399.0,2024-09-02 00:00:00,103.16
700,2626.0,2024-09-02 00:00:00,33.4
701,2979.0,02/09/2024 00:00:00,84.96
702,1812.0,2024-09-02 00:00:00,170.21
703,266.0,2024-09-02 00:00:00,345.74
704,793.0,2024-09-02 00:00:00,130.54
705,1313.0,2024-09-02 00:00:00,512.16
706,1806.0,2024-09-02 00:00:00,29.98
707,2384.0,2024-09-02 00:00:00,289.47
708,2429.0,2024-09-02 00:00:00,76.41
709,2531.0,2024-09-02 00:00:00,101.72
710,1049.0,2024-09-02 00:00:00,219.51
711,2530.0,2024-09-02 00:00:00,14.12
712,964.0,2024-09-02 00:00:00,29.04
713,1604.0,2024-09-02 00:00:00,16.67
714,128.0,2024-09-02 00:00:00,113.3
715,543.0,2024-09-03 00:00:00,141.1
716,1682.0,2024-09-03 00:00:00,65.08
717,2495.0,2024-09-03 00:00:00,204.79
718,1885.0,2024-09-03 00:00:00,10.0
719,1084.0,2024-09-03 00:00:00,90.76
720,2335.0,2024-09-03 00:00:00,12.66
721,1954.0,2024-09-03 00:00:00,123.16
722,642.0,2024-09-03 00:00:00,132.56
723,690.0,2024-09-03 00:00:00,11.9
724,1080.0,2024-09-03 00:00:00,70.58
725,983.0,2024-09-03 00:00:00,54.67
726,1123.0,2024-09-03 00:00:00,15.51
727,1180.0,2024-09-03 00:00:00,72.27
728,883.0,2024-09-03 00:00:00,39.15
729,400.0,2024-09-03 00:00:00,12.86
730,1796.0,2024-09-03 00:00:00,1142.58
731,2833.0,2024-09-03 00:00:00,52.96
732,1404.0,2024-09-03 00:00:00,73.13
733,820.0,2024-09-03 00:00:00,213.26
734,422.0,2024-09-04 00:00:00,111.05
735,1509.0,2024-09-04 00:00:00,435.37
736,1598.0,2024-09-04 00:00:00,212.31
737,2531.0,2024-09-04 00:00:00,91.7
738,2140.0,2024-09-04 00:00:00,131.42
739,2503.0,2024-09-04 00:00:00,264.56
740,2646.0,2024-09-04 00:00:00,663.86
741,1207.0,2024-09-04 00:00:00,107.62
742,2453.0,2024-09-04 00:00:00,10.0
743,2709.0,2024-09-04 00:00:00,285.66
744,1912.0,2024-09-04 00:00:00,153.28
745,2113.0,2024-09-04 00:00:00,78.16
746,2010.0,2024-09-04 00:00:00,55.2
747,2386.0,2024-09-04 00:00:00,13.36
748,672.0,2024-09-04 00:00:00,133.83
749,497.0,2024-09-04 00:00:00,158.8
750,703.0,2024-09-04 00:00:00,138.36
751,1792.0,2024-09-04 00:00:00,20.65
752,2558.0,2024-09-04 00:00:00,32.52
753,1588.0,2024-09-05 00:00:00,55.8
754,594.0,2024-09-05 00:00:00,129.26
755,1769.0,2024-09-05 00:00:00,190.43
756,1949.0,2024-09-05 00:00:00,123.03
757,2069.0,2024-09-05 00:00:00,625.73
758,2673.0,2024-09-05 00:00:00,621.71
759,17.0,2024-09-05 00:00:00,214.99
760,425.0,2024-09-05 00:00:00,233.04
761,572.0,2024-09-05 00:00:00,15.9
762,1121.0,2024-09-05 00:00:00,367.61
763,2280.0,2024-09-05 00:00:00,123.79
764,715.0,2024-09-05 00:00:00,136.82
765,776.0,2024-09-05 00:00:00,450.98
766,2248.0,2024-09-05 00:00:00,51.49
767,856.0,2024-09-05 00:00:00,428.19
768,2629.0,2024-09-05 00:00:00,267.45
769,2497.0,2024-09-05 00:00:00,117.14
770,1032.0,2024-09-05 00:00:00,10.0
771,87.0,2024-09-05 00:00:00,251.98
772,408.0,2024-09-05 00:00:00,22.27
773,1669.0,2024-09-05 00:00:00,142.09
774,232.0,2024-09-05 00:00:00,87.16
775,366.0,2024-09-05 00:00:00,955.63
776,436.0,2024-09-05 00:00:00,298.02
777,1415.0,2024-09-05 00:00:00,306.35
778,563.0,2024-09-05 00:00:00,38.26
779,1285.0,2024-09-05 00:00:00,159.53
780,2038.0,2024-09-05 00:00:00,289.1
781,1344.0,2024-09-05 00:00:00,110.43
782,992.0,2024-09-06 00:00:00,144.58
783,1247.0,2024-09-06 00:00:00,305.1
784,360.0,2024-09-06 00:00:00,195.99
785,2511.0,2024-09-06 00:00:00,46.06
786,1828.0,2024-09-06 00:00:00,190.91
787,1614.0,2024-09-06 00:00:00,14.35
788,217.0,2024-09-06 00:00:00,151.13
789,190.0,2024-09-06 00:00:00,452.32
790,1802.0,2024-09-06 00:00:00,320.61
791,652.0,2024-09-06 00:00:00,128.62
792,770.0,2024-09-06 00:00:00,184.2
793,1717.0,2024-09-06 00:00:00,505.89
794,1312.0,2024-09-06 00:00:00,191.68
795,1250.0,2024-09-06 00:00:00,27.42
796,783.0,2024-09-06 00:00:00,23.49
797,2231.0,2024-09-06 00:00:00,19.97
798,488.0,2024-09-06 00:00:00,113.15
799,2172.0,2024-09-06 00:00:00,98.42
800,2838.0,2024-09-07 00:00:00,63.98
801,2004.0,2024-09-07 00:00:00,25.91
802,686.0,07/09/2024 00:00:00,10.0
803,2170.0,2024-09-07 00:00:00,338.51
804,39.0,2024-09-07 00:00:00,374.83
805,1257.0,2024-09-07 00:00:00,157.06
806,2197.0,07/09/2024 00:00:00,281.33
807,2709.0,2024-09-07 00:00:00,766.99
808,302.0,2024-09-07 00:00:00,260.75
809,647.0,2024-09-07 00:00:00,39.84
810,1760.0,2024-09-07 00:00:00,39.06
811,598.0,2024-09-07 00:00:00,279.83
812,1369.0,2024-09-07 00:00:00,554.16
813,770.0,2024-09-07 00:00:00,28.25
814,463.0,2024-09-07 00:00:00,19.27
815,1487.0,2024-09-07 00:00:00,140.98
816,88.0,2024-09-07 00:00:00,83.83
817,2326.0,2024-09-07 00:00:00,156.28
818,1725.0,2024-09-07 00:00:00,272.07
819,515.0,2024-09-07 00:00:00,70.64
820,2067.0,2024-09-07 00:00:00,32.87
821,1054.0,2024-09-07 00:00:00,413.22
822,1305.0,2024-09-08 00:00:00,286.36
823,1135.0,2024-09-08 00:00:00,35.07
824,2177.0,2024-09-08 00:00:00,270.74
825,515.0,2024-09-08 00:00:00,960.97
826,1507.0,2024-09-08 00:00:00,102.66
827,874.0,2024-09-08 00:00:00,214.33
828,2521.0,2024-09-08 00:00:00,161.97
829,2350.0,2024-09-08 00:00:00,191.41
830,923.0,2024-09-08 00:00:00,232.88
831,2160.0,2024-09-08 00:00:00,306.3
832,2548.0,2024-09-08 00:00:00,148.53
833,2282.0,08/09/2024 00:00:00,286.25
834,2614.0,2024-09-08 00:00:00,357.57
835,1998.0,2024-09-08 00:00:00,45.25
836,2635.0,2024-09-08 00:00:00,282.33
837,1015.0,2024-09-08 00:00:00,127.1
838,1125.0,2024-09-08 00:00:00,26.64
839,1405.0,2024-09-08 00:00:00,206.21
840,1930.0,2024-09-08 00:00:00,434.66
841,227.0,2024-09-08 00:00:00,29.66
842,1493.0,2024-09-09 00:00:00,10.0
843,871.0,2024-09-09 00:00:00,10.0
844,2086.0,2024-09-09 00:00:00,36.52
845,188.0,2024-09-09 00:00:00,316.17
846,2321.0,2024-09-09 00:00:00,177.44
847,2564.0,2024-09-09 00:00:00,142.71
848,336.0,2024-09-09 00:00:00,51.09
849,2548.0,2024-09-09 00:00:00,164.5
850,2814.0,2024-09-09 00:00:00,133.34
851,594.0,2024-09-09 00:00:00,184.33
852,60.0,2024-09-09 00:00:00,77.75
853,1902.0,2024-09-09 00:00:00,32.27
854,664.0,2024-09-09 00:00:00,81.36
855,542.0,2024-09-09 00:00:00,803.13
856,1141.0,2024-09-09 00:00:00,310.81
857,2067.0,2024-09-09 00:00:00,116.03
858,740.0,2024-09-09 00:00:00,26.11
859,2161.0,2024-09-09 00:00:00,113.84
860,1170.0,2024-09-09 00:00:00,92.86
861,1137.0,2024-09-09 00:00:00,182.37
862,2811.0,2024-09-09 00:00:00,290.99
863,1020.0,2024-09-09 00:00:00,71.18
864,161.0,09/09/2024 00:00:00,109.38
865,1284.0,2024-09-09 00:00:00,137.1
866,,2024-09-09 00:00:00,25.19
867,1734.0,2024-09-09 00:00:00,944.94
868,2172.0,2024-09-09 00:00:00,96.85
869,2185.0,2024-09-09 00:00:00,600.4
870,837.0,2024-09-10 00:00:00,40.78
871,1597.0,2024-09-10 00:00:00,778.9
872,1795.0,2024-09-10 00:00:00,10.0
873,1886.0,2024-09-10 00:00:00,356.4
874,2029.0,2024-09-10 00:00:00,239.25
875,1901.0,2024-09-10 00:00:00,305.19
876,1450.0,2024-09-10 00:00:00,383.09
877,922.0,2024-09-10 00:00:00,412.29
878,1373.0,2024-09-10 00:00:00,123.88
879,2004.0,2024-09-10 00:00:00,324.55
880,704.0,2024-09-10 00:00:00,131.93
881,1626.0,2024-09-10 00:00:00,16.81
882,2791.0,2024-09-10 00:00:00,468.5
883,2979.0,2024-09-10 00:00:00,114.84
884,2660.0,2024-09-10 00:00:00,290.07
885,1206.0,2024-09-10 00:00:00,51.04
886,188.0,2024-09-10 00:00:00,101.78
887,1620.0,2024-09-10 00:00:00,213.98
888,548.0,2024-09-10 00:00:00,10.0
889,1432.0,2024-09-10 00:00:00,11.75
890,2462.0,2024-09-10 00:00:00,10.0
891,903.0,2024-09-10 00:00:00,56.73
892,270.0,2024-09-11 00:00:00,57.42
893,2015.0,2024-09-11 00:00:00,119.47
894,205.0,2024-09-11 00:00:00,62.43
895,841.0,2024-09-11 00:00:00,133.72
896,1720.0,2024-09-11 00:00:00,10.0
897,2298.0,2024-09-11 00:00:00,165.1
898,2244.0,2024-09-11 00:00:00,75.72
899,2011.0,2024-09-11 00:00:00,85.34
900,2687.0,2024-09-11 00:00:00,54.04
901,672.0,2024-09-11 00:00:00,218.0
902,1172.0,2024-09-11 00:00:00,27.39
903,944.0,2024-09-11 00:00:00,552.36
904,1450.0,2024-09-11 00:00:00,351.9
905,896.0,2024-09-11 00:00:00,195.86
906,165.0,2024-09-11 00:00:00,795.82
907,1106.0,2024-09-11 00:00:00,31.32
908,1754.0,2024-09-11 00:00:00,42.44
909,2353.0,2024-09-11 00:00:00,124.7
910,1881.0,2024-09-11 00:00:00,587.63
911,1932.0,2024-09-12 00:00:00,86.0
912,425.0,2024-09-12 00:00:00,10.0
913,629.0,2024-09-12 00:00:00,51.06
914,2538.0,2024-09-12 00:00:00,18.61
915,598.0,2024-09-12 00:00:00,164.75
916,593.0,2024-09-12 00:00:00,787.64
917,573.0,2024-09-12 00:00:00,393.42
918,2091.0,2024-09-12 00:00:00,14.01
919,177.0,2024-09-12 00:00:00,156.85
920,966.0,2024-09-12 00:00:00,51.27
921,2658.0,2024-09-12 00:00:00,132.6
922,853.0,2024-09-12 00:00:00,30.39
923,2070.0,2024-09-12 00:00:00,379.39
924,2890.0,2024-09-12 00:00:00,124.09
925,1904.0,2024-09-12 00:00:00,123.3
926,588.0,2024-09-12 00:00:00,12.86
927,1318.0,2024-09-12 00:00:00,328.4
928,611.0,2024-09-12 00:00:00,10.67
929,1855.0,2024-09-12 00:00:00,137.53
930,2080.0,2024-09-12 00:00:00,59.85
931,532.0,2024-09-12 00:00:00,157.42
932,1092.0,2024-09-12 00:00:00,282.73
933,2262.0,2024-09-12 00:00:00,10.0
934,2792.0,2024-09-12 00:00:00,420.47
935,1750.0,12/09/2024 00:00:00,35.26
936,782.0,2024-09-12 00:00:00,54.57
937,2728.0,12/09/2024 00:00:00,839.8
938,881.0,2024-09-12 00:00:00,10.0
939,1784.0,2024-09-12 00:00:00,124.7
940,1992.0,2024-09-12 00:00:00,66.38
941,1578.0,2024-09-13 00:00:00,137.76
942,774.0,13/09/2024 00:00:00,93.02
943,1815.0,2024-09-13 00:00:00,345.31
944,1202.0,2024-09-13 00:00:00,19.61
945,2757.0,2024-09-13 00:00:00,667.51
946,2552.0,2024-09-13 00:00:00,41.34
947,8.0,2024-09-13 00:00:00,67.69
948,476.0,2024-09-13 00:00:00,283.34
949,485.0,2024-09-13 00:00:00,201.34
950,2615.0,2024-09-13 00:00:00,205.82
951,1968.0,2024-09-13 00:00:00,454.52
952,1234.0,2024-09-13 00:00:00,34.38
953,468.0,2024-09-13 00:00:00,163.21
954,2434.0,2024-09-13 00:00:00,76.18
955,2435.0,2024-09-13 00:00:00,90.23
956,283.0,2024-09-13 00:00:00,64.84
957,40.0,2024-09-13 00:00:00,141.47
958,2268.0,2024-09-13 00:00:00,45.13
959,613.0,2024-09-13 00:00:00,263.83
960,688.0,2024-09-13 00:00:00,33.0
961,2308.0,2024-09-13 00:00:00,320.49
962,2414.0,2024-09-13 00:00:00,17.43
963,2592.0,2024-09-13 00:00:00,25.03
964,1931.0,2024-09-13 00:00:00,140.72
965,1153.0,2024-09-13 00:00:00,108.17
966,1911.0,2024-09-13 00:00:00,26.12
967,670.0,14/09/2024 00:00:00,201.39
968,1284.0,2024-09-14 00:00:00,1167.11
969,1530.0,2024-09-14 00:00:00,111.54
970,247.0,2024-09-14 00:00:00,27.81
971,1561.0,2024-09-14 00:00:00,19.53
972,2244.0,2024-09-14 00:00:00,254.13
973,930.0,2024-09-14 00:00:00,47.08
974,2693.0,2024-09-14 00:00:00,725.8
975,265.0,2024-09-14 00:00:00,341.92
976,1458.0,2024-09-14 00:00:00,23.48
977,1419.0,14/09/2024 00:00:00,463.13
978,1388.0,2024-09-14 00:00:00,122.97
979,2773.0,2024-09-14 00:00:00,58.69
980,982.0,2024-09-14 00:00:00,352.34
981,476.0,2024-09-14 00:00:00,149.07
982,2204.0,2024-09-14 00:00:00,349.71
983,190.0,2024-09-15 00:00:00,253.94
984,1699.0,2024-09-15 00:00:00,30.62
985,41.0,2024-09-15 00:00:00,269.16
986,338.0,2024-09-15 00:00:00,276.32
987,11.0,2024-09-15 00:00:00,114.36
988,896.0,2024-09-15 00:00:00,86.89
989,2885.0,2024-09-15 00:00:00,328.18
990,2910.0,2024-09-15 00:00:00,773.65
991,931.0,2024-09-15 00:00:00,10.0
992,2941.0,2024-09-15 00:00:00,225.51
993,1090.0,2024-09-15 00:00:00,75.64
994,2296.0,15/09/2024 00:00:00,14.44
995,1959.0,2024-09-15 00:00:00,36.58
996,1684.0,2024-09-15 00:00:00,51.54
997,968.0,2024-09-15 00:00:00,15.09
998,640.0,2024-09-15 00:00:00,205.94
999,2564.0,2024-09-15 00:00:00,402.56
1000,1839.0,2024-09-15 00:00:00,72.86
1001,533.0,2024-09-15 00:00:00,10.0
1002,949.0,2024-09-15 00:00:00,211.78
1003,2020.0,2024-09-15 00:00:00,409.91
1004,551.0,2024-09-15 00:00:00,329.42
1005,1788.0,2024-09-15 00:00:00,218.72
1006,2258.0,2024-09-15 00:00:00,210.4
1007,646.0,2024-09-15 00:00:00,222.18
1008,2455.0,2024-09-16 00:00:00,37.04
1009,1378.0,2024-09-16 00:00:00,118.5
1010,2598.0,2024-09-16 00:00:00,51.43
1011,501.0,2024-09-16 00:00:00,158.22
1012,1683.0,2024-09-16 00:00:00,752.72
1013,1531.0,2024-09-16 00:00:00,109.83
1014,281.0,2024-09-16 00:00:00,109.44
1015,270.0,2024-09-16 00:00:00,500.39
1016,1751.0,2024-09-16 00:00:00,27.27
1017,83.0,2024-09-16 00:00:00,720.73
1018,2947.0,2024-09-16 00:00:00,280.45
1019,2332.0,2024-09-16 00:00:00,10.0
1020,2811.0,2024-09-16 00:00:00,197.9
1021,633.0,2024-09-16 00:00:00,66.12
1022,2991.0,2024-09-16 00:00:00,119.51
1023,1144.0,2024-09-16 00:00:00,243.27
1024,1853.0,2024-09-16 00:00:00,14.16
1025,2513.0,2024-09-16 00:00:00,55.39
1026,2368.0,2024-09-16 00:00:00,167.48
1027,2868.0,2024-09-17 00:00:00,71.7
1028,1227.0,2024-09-17 00:00:00,15.43
1029,2382.0,17/09/2024 00:00:00,271.89
1030,1732.0,2024-09-17 00:00:00,13.33
1031,988.0,2024-09-17 00:00:00,382.47
1032,1622.0,2024-09-17 00:00:00,445.69
1033,1279.0,2024-09-17 00:00:00,16.45
1034,2525.0,2024-09-17 00:00:00,364.22
1035,2480.0,2024-09-17 00:00:00,10.0
1036,1059.0,2024-09-17 00:00:00,62.33
1037,494.0,2024-09-17 00:00:00,387.17
1038,1791.0,2024-09-17 00:00:00,215.07
1039,1328.0,2024-09-17 00:00:00,356.01
1040,1987.0,2024-09-17 00:00:00,134.03
1041,2045.0,2024-09-17 00:00:00,148.99
1042,1929.0,2024-09-18 00:00:00,221.25
1043,977.0,2024-09-18 00:00:00,13.37
1044,2528.0,2024-09-18 00:00:00,169.62
1045,343.0,2024-09-18 00:00:00,112.57
1046,2380.0,2024-09-18 00:00:00,483.1
1047,2222.0,2024-09-18 00:00:00,297.34
1048,1897.0,2024-09-18 00:00:00,83.35
1049,820.0,2024-09-18 00:00:00,117.17
1050,2280.0,2024-09-18 00:00:00,591.72
1051,1574.0,2024-09-18 00:00:00,179.15
1052,179.0,2024-09-18 00:00:00,54.21
1053,1479.0,2024-09-18 00:00:00,28.24
1054,772.0,18/09/2024 00:00:00,97.07
1055,579.0,2024-09-18 00:00:00,211.24
1056,194.0,2024-09-18 00:00:00,63.37
1057,2395.0,2024-09-18 00:00:00,272.2
1058,1793.0,2024-09-18 00:00:00,62.66
1059,2262.0,2024-09-18 00:00:00,58.71
1060,1937.0,2024-09-18 00:00:00,10.0
1061,262.0,2024-09-18 00:00:00,10.0
1062,1491.0,2024-09-19 00:00:00,64.82
1063,441.0,2024-09-19 00:00:00,80.5
1064,2801.0,2024-09-19 00:00:00,194.85
1065,142.0,2024-09-19 00:00:00,188.72
1066,2797.0,2024-09-19 00:00:00,128.6
1067,1713.0,2024-09-19 00:00:00,145.37
1068,998.0,2024-09-19 00:00:00,385.02
1069,881.0,2024-09-19 00:00:00,49.45
1070,555.0,2024-09-19 00:00:00,371.48
1071,2913.0,2024-09-19 00:00:00,82.76
1072,341.0,2024-09-19 00:00:00,115.44
1073,704.0,2024-09-19 00:00:00,143.76
1074,1387.0,2024-09-19 00:00:00,10.0
1075,2281.0,2024-09-19 00:00:00,101.17
1076,1573.0,2024-09-19 00:00:00,66.97
1077,856.0,2024-09-19 00:00:00,151.69
1078,183.0,2024-09-19 00:00:00,414.65
1079,397.0,2024-09-19 00:00:00,225.04
1080,1518.0,2024-09-19 00:00:00,987.2
1081,1357.0,2024-09-19 00:00:00,530.22
1082,1.0,2024-09-19 00:00:00,98.82
1083,19.0,2024-09-19 00:00:00,105.87
1084,456.0,2024-09-19 00:00:00,222.3
1085,1133.0,2024-09-20 00:00:00,187.25
1086,1953.0,2024-09-20 00:00:00,347.22
1087,2151.0,2024-09-20 00:00:00,615.97
1088,520.0,2024-09-20 00:00:00,397.38
1089,174.0,2024-09-20 00:00:00,10.5
1090,2479.0,2024-09-20 00:00:00,12.27
1091,1711.0,2024-09-20 00:00:00,410.52
1092,1682.0,2024-09-20 00:00:00,24.32
1093,990.0,2024-09-20 00:00:00,322.24
1094,420.0,2024-09-20 00:00:00,92.11
1095,1775.0,2024-09-20 00:00:00,108.58
1096,1108.0,2024-09-20 00:00:00,461.16
1097,332.0,20/09/2024 00:00:00,16.72
1098,2703.0,2024-09-20 00:00:00,277.14
1099,1794.0,2024-09-20 00:00:00,220.87
1100,105.0,2024-09-20 00:00:00,207.95
1101,1843.0,2024-09-20 00:00:00,180.11
1102,1290.0,2024-09-20 00:00:00,139.49
1103,563.0,2024-09-20 00:00:00,489.03
1104,1564.0,2024-09-20 00:00:00,37.71
1105,2502.0,2024-09-20 00:00:00,25.69
1106,1629.0,2024-09-20 00:00:00,13.75
1107,1936.0,2024-09-20 00:00:00,948.04
1108,2306.0,2024-09-20 00:00:00,10.0
1109,268.0,2024-09-20 00:00:00,69.92
1110,1857.0,2024-09-20 00:00:00,17.63
1111,1999.0,2024-09-20 00:00:00,10.0
1112,1237.0,2024-09-20 00:00:00,330.08
1113,1151.0,2024-09-20 00:00:00,84.07
1114,1432.0,2024-09-21 00:00:00,211.28
1115,1820.0,21/09/2024 00:00:00,98.01
1116,1131.0,2024-09-21 00:00:00,112.4
1117,2659.0,2024-09-21 00:00:00,16.16
1118,2121.0,2024-09-21 00:00:00,73.15
1119,1054.0,2024-09-21 00:00:00,118.27
1120,1890.0,2024-09-21 00:00:00,96.98
1121,2243.0,2024-09-21 00:00:00,389.77
1122,2895.0,2024-09-21 00:00:00,284.88
1123,2071.0,2024-09-21 00:00:00,76.8
1124,2608.0,2024-09-21 00:00:00,10.0
1125,1142.0,2024-09-21 00:00:00,244.55
1126,1944.0,2024-09-21 00:00:00,93.86
1127,2488.0,2024-09-21 00:00:00,36.22
1128,7.0,2024-09-21 00:00:00,30.77
1129,1592.0,2024-09-21 00:00:00,287.02
1130,2607.0,2024-09-21 00:00:00,33.56
1131,914.0,2024-09-21 00:00:00,202.62
1132,1451.0,2024-09-21 00:00:00,97.51
1133,126.0,2024-09-21 00:00:00,181.26
1134,2929.0,2024-09-21 00:00:00,226.1
1135,2373.0,2024-09-21 00:00:00,151.47
1136,1464.0,2024-09-21 00:00:00,885.17
1137,833.0,2024-09-21 00:00:00,22.24
1138,1649.0,2024-09-21 00:00:00,30.29
1139,2885.0,2024-09-21 00:00:00,51.88
1140,443.0,2024-09-21 00:00:00,151.82
1141,557.0,2024-09-22 00:00:00,96.97
1142,1179.0,2024-09-22 00:00:00,46.86
1143,363.0,2024-09-22 00:00:00,98.2
1144,1258.0,2024-09-22 00:00:00,100.65
1145,2310.0,2024-09-22 00:00:00,282.29
1146,911.0,2024-09-22 00:00:00,133.83
1147,2533.0,2024-09-22 00:00:00,360.94
1148,1573.0,2024-09-22 00:00:00,624.34
1149,2694.0,2024-09-22 00:00:00,184.74
1150,2044.0,2024-09-22 00:00:00,157.66
1151,797.0,2024-09-22 00:00:00,68.05
1152,2479.0,2024-09-22 00:00:00,32.88
1153,1937.0,2024-09-22 00:00:00,97.39
1154,1302.0,2024-09-22 00:00:00,155.92
1155,2353.0,2024-09-22 00:00:00,151.97
1156,365.0,2024-09-22 00:00:00,287.01
1157,1403.0,2024-09-22 00:00:00,364.71
1158,2947.0,2024-09-22 00:00:00,72.0
1159,1440.0,2024-09-22 00:00:00,246.9
1160,762.0,2024-09-22 00:00:00,11.88
1161,2990.0,2024-09-22 00:00:00,226.26
1162,1557.0,2024-09-22 00:00:00,678.75
1163,359.0,2024-09-22 00:00:00,157.42
1164,1628.0,2024-09-22 00:00:00,174.93
1165,2531.0,2024-09-22 00:00:00,32.63
1166,2914.0,2024-09-22 00:00:00,134.24
1167,2483.0,2024-09-22 00:00:00,305.01
1168,2152.0,2024-09-22 00:00:00,78.85
1169,2810.0,2024-09-23 00:00:00,123.77
1170,999.0,2024-09-23 00:00:00,100.55
1171,1308.0,2024-09-23 00:00:00,382.86
1172,2661.0,2024-09-23 00:00:00,156.63
1173,2047.0,2024-09-23 00:00:00,665.01
1174,1141.0,2024-09-23 00:00:00,182.82
1175,1846.0,2024-09-23 00:00:00,152.45
1176,2294.0,2024-09-23 00:00:00,28.0
1177,2443.0,2024-09-23 00:00:00,159.4
1178,977.0,2024-09-23 00:00:00,228.36
1179,1961.0,2024-09-23 00:00:00,419.26
1180,1606.0,2024-09-23 00:00:00,32.22
1181,2195.0,2024-09-23 00:00:00,143.86
1182,2668.0,2024-09-23 00:00:00,132.1
1183,864.0,23/09/2024 00:00:00,135.43
1184,695.0,2024-09-23 00:00:00,94.11
1185,1611.0,2024-09-23 00:00:00,45.44
1186,1240.0,2024-09-23 00:00:00,116.4
1187,1947.0,2024-09-23 00:00:00,143.19
1188,2809.0,2024-09-23 00:00:00,89.97
1189,1715.0,2024-09-23 00:00:00,449.72
1190,82.0,2024-09-23 00:00:00,117.2
1191,1711.0,2024-09-23 00:00:00,289.23
1192,2820.0,2024-09-23 00:00:00,328.59
1193,163.0,2024-09-23 00:00:00,44.75
1194,1864.0,2024-09-24 00:00:00,384.78
1195,2385.0,24/09/2024 00:00:00,375.42
1196,840.0,2024-09-24 00:00:00,12.9
1197,1347.0,2024-09-24 00:00:00,118.96
1198,1037.0,2024-09-24 00:00:00,711.8
1199,1725.0,2024-09-24 00:00:00,521.77
1200,2768.0,2024-09-24 00:00:00,287.6
1201,22.0,2024-09-24 00:00:00,232.77
1202,683.0,2024-09-24 00:00:00,411.22
1203,2954.0,2024-09-24 00:00:00,28.87
1204,126.0,2024-09-24 00:00:00,206.83
1205,1228.0,2024-09-24 00:00:00,326.37
1206,696.0,2024-09-24 00:00:00,150.4
1207,19.0,2024-09-24 00:00:00,44.79
1208,2842.0,2024-09-24 00:00:00,352.6
1209,542.0,2024-09-24 00:00:00,10.0
1210,1089.0,2024-09-24 00:00:00,83.64
1211,1573.0,2024-09-24 00:00:00,269.78
1212,1573.0,2024-09-24 00:00:00,10.0
1213,648.0,2024-09-24 00:00:00,293.0
1214,201.0,2024-09-24 00:00:00,290.59
1215,547.0,2024-09-24 00:00:00,190.18
1216,802.0,2024-09-24 00:00:00,16.17
1217,414.0,2024-09-24 00:00:00,10.0
1218,1099.0,2024-09-24 00:00:00,85.79
1219,910.0,2024-09-25 00:00:00,330.3
1220,2016.0,2024-09-25 00:00:00,15.01
1221,2131.0,2024-09-25 00:00:00,147.87
1222,1552.0,2024-09-25 00:00:00,228.98
1223,1681.0,2024-09-25 00:00:00,138.88
1224,2370.0,2024-09-25 00:00:00,15.14
1225,1037.0,2024-09-25 00:00:00,219.84
1226,1951.0,2024-09-25 00:00:00,52.89
1227,2343.0,2024-09-25 00:00:00,102.6
1228,1239.0,2024-09-25 00:00:00,529.66
1229,1591.0,2024-09-25 00:00:00,473.13
1230,2781.0,2024-09-25 00:00:00,175.06
1231,2369.0,2024-09-25 00:00:00,159.25
1232,1694.0,2024-09-25 00:00:00,772.47
1233,1557.0,2024-09-25 00:00:00,48.32
1234,1305.0,2024-09-25 00:00:00,26.23
1235,2385.0,2024-09-25 00:00:00,254.44
1236,2592.0,2024-09-25 00:00:00,119.33
1237,1480.0,2024-09-25 00:00:00,161.78
1238,660.0,2024-09-25 00:00:00,229.53
1239,2460.0,2024-09-26 00:00:00,53.49
1240,53.0,2024-09-26 00:00:00,325.89
1241,1046.0,2024-09-26 00:00:00,165.7
1242,2308.0,2024-09-26 00:00:00,30.83
1243,1495.0,2024-09-26 00:00:00,255.06
1244,1036.0,2024-09-26 00:00:00,137.31
1245,850.0,2024-09-26 00:00:00,347.2
1246,1099.0,2024-09-26 00:00:00,63.37
1247,1465.0,2024-09-26 00:00:00,10.0
1248,1885.0,2024-09-26 00:00:00,10.0
1249,2342.0,2024-09-26 00:00:00,452.15
1250,1112.0,2024-09-26 00:00:00,365.69
1251,1961.0,2024-09-26 00:00:00,83.22
1252,2988.0,2024-09-26 00:00:00,270.11
1253,1181.0,2024-09-26 00:00:00,534.4
1254,633.0,2024-09-26 00:00:00,89.33
1255,137.0,2024-09-26 00:00:00,369.94
1256,428.0,2024-09-26 00:00:00,169.64
1257,2959.0,2024-09-26 00:00:00,572.88
1258,1107.0,2024-09-26 00:00:00,481.46
1259,,2024-09-26 00:00:00,550.78
1260,2739.0,2024-09-26 00:00:00,18.71
1261,471.0,2024-09-26 00:00:00,136.17
1262,929.0,2024-09-26 00:00:00,532.34
1263,2680.0,2024-09-26 00:00:00,225.31
1264,2223.0,2024-09-26 00:00:00,36.53
1265,235.0,2024-09-26 00:00:00,219.55
1266,929.0,2024-09-27 00:00:00,65.27
1267,523.0,2024-09-27 00:00:00,602.26
1268,431.0,2024-09-27 00:00:00,576.42
1269,1737.0,2024-09-27 00:00:00,22.27
1270,1747.0,2024-09-27 00:00:00,206.65
1271,2858.0,2024-09-27 00:00:00,22.14
1272,1526.0,2024-09-27 00:00:00,628.38
1273,2588.0,2024-09-27 00:00:00,401.71
1274,1379.0,2024-09-27 00:00:00,122.39
1275,1682.0,2024-09-27 00:00:00,201.26
1276,227.0,2024-09-27 00:00:00,92.35
1277,892.0,2024-09-27 00:00:00,391.74
1278,1037.0,2024-09-27 00:00:00,107.74
1279,397.0,2024-09-27 00:00:00,107.5
1280,2946.0,2024-09-27 00:00:00,47.65
1281,329.0,2024-09-27 00:00:00,407.68
1282,952.0,2024-09-27 00:00:00,208.66
1283,2669.0,2024-09-28 00:00:00,280.5
1284,1773.0,2024-09-28 00:00:00,70.0
1285,1752.0,2024-09-28 00:00:00,534.17
1286,1828.0,2024-09-28 00:00:00,268.34
1287,1052.0,2024-09-28 00:00:00,734.54
1288,940.0,2024-09-28 00:00:00,100.55
1289,2536.0,2024-09-28 00:00:00,126.28
1290,1089.0,2024-09-28 00:00:00,441.85
1291,235.0,2024-09-28 00:00:00,91.71
1292,2097.0,2024-09-28 00:00:00,23.65
1293,1674.0,2024-09-28 00:00:00,156.97
1294,2101.0,2024-09-28 00:00:00,232.98
1295,1816.0,2024-09-28 00:00:00,364.36
1296,2916.0,2024-09-28 00:00:00,594.58
1297,675.0,2024-09-28 00:00:00,135.8
1298,2159.0,2024-09-28 00:00:00,80.17
1299,884.0,2024-09-28 00:00:00,10.0
1300,171.0,2024-09-28 00:00:00,420.17
1301,1402.0,2024-09-28 00:00:00,146.39
1302,2278.0,2024-09-28 00:00:00,287.36
1303,119.0,28/09/2024 00:00:00,297.44
1304,2513.0,2024-09-28 00:00:00,147.33
1305,2746.0,2024-09-28 00:00:00,389.16
1306,1706.0,2024-09-28 00:00:00,294.07
1307,2793.0,2024-09-28 00:00:00,25.61
1308,1760.0,2024-09-28 00:00:00,69.43
1309,33.0,2024-09-28 00:00:00,268.67
1310,2567.0,2024-09-28 00:00:00,85.57
1311,2060.0,2024-09-29 00:00:00,10.0
1312,2603.0,2024-09-29 00:00:00,217.54
1313,973.0,2024-09-29 00:00:00,731.43
1314,2671.0,2024-09-29 00:00:00,225.14
1315,2208.0,2024-09-29 00:00:00,457.66
1316,225.0,2024-09-29 00:00:00,186.36
1317,1480.0,2024-09-29 00:00:00,46.41
1318,1083.0,2024-09-29 00:00:00,72.17
1319,195.0,2024-09-29 00:00:00,247.67
1320,2205.0,2024-09-29 00:00:00,56.63
1321,2460.0,2024-09-29 00:00:00,128.26
1322,1148.0,2024-09-29 00:00:00,128.42
1323,1242.0,2024-09-29 00:00:00,174.55
1324,1128.0,2024-09-29 00:00:00,571.98
1325,1848.0,2024-09-29 00:00:00,949.53
1326,434.0,2024-09-29 00:00:00,206.9
1327,2588.0,2024-09-29 00:00:00,300.05
1328,1553.0,2024-09-29 00:00:00,51.08
1329,2410.0,2024-09-29 00:00:00,452.82
1330,1418.0,2024-09-29 00:00:00,75.71
1331,2315.0,2024-09-29 00:00:00,799.66
1332,2504.0,2024-09-29 00:00:00,202.1
1333,1007.0,2024-09-29 00:00:00,35.8
1334,1995.0,2024-09-29 00:00:00,60.2
1335,1073.0,2024-09-29 00:00:00,588.99
1336,216.0,2024-09-29 00:00:00,258.18
1337,1593.0,29/09/2024 00:00:00,441.71
1338,2537.0,2024-09-29 00:00:00,234.24
1339,2842.0,29/09/2024 00:00:00,31.87
1340,2053.0,2024-09-30 00:00:00,137.56
1341,2409.0,2024-09-30 00:00:00,118.72
1342,1590.0,2024-09-30 00:00:00,107.45
1343,2470.0,2024-09-30 00:00:00,150.86
1344,2063.0,2024-09-30 00:00:00,87.47
1345,1146.0,2024-09-30 00:00:00,227.65
1346,2501.0,2024-09-30 00:00:00,194.0
1347,2646.0,2024-09-30 00:00:00,286.14
1348,2762.0,2024-09-30 00:00:00,39.77
1349,1758.0,2024-09-30 00:00:00,164.59
1350,1542.0,2024-09-30 00:00:00,117.95
1351,493.0,2024-09-30 00:00:00,10.25
1352,2379.0,2024-09-30 00:00:00,315.15
1353,1547.0,30/09/2024 00:00:00,99.47
1354,1606.0,2024-09-30 00:00:00,23.06
1355,580.0,2024-09-30 00:00:00,604.95
1356,2608.0,2024-09-30 00:00:00,104.4
1357,2494.0,2024-09-30 00:00:00,168.58
1358,1163.0,2024-09-30 00:00:00,122.85
1359,2322.0,2024-09-30 00:00:00,180.06
1360,2359.0,2024-09-30 00:00:00,48.15
1361,2002.0,2024-09-30 00:00:00,794.54
1362,1284.0,2024-09-30 00:00:00,353.68
1363,797.0,2024-09-30 00:00:00,476.97
1364,1297.0,2024-09-30 00:00:00,644.45
1365,245.0,2024-09-30 00:00:00,611.08
1366,930.0,2024-09-30 00:00:00,283.19
1367,2410.0,2024-10-01 00:00:00,129.6
1368,2020.0,2024-10-01 00:00:00,56.83
1369,2881.0,2024-10-01 00:00:00,122.58
1370,2641.0,2024-10-01 00:00:00,35.51
1371,2802.0,2024-10-01 00:00:00,295.35
1372,86.0,2024-10-01 00:00:00,184.8
1373,2469.0,2024-10-01 00:00:00,10.0
1374,1637.0,2024-10-01 00:00:00,94.64
1375,2219.0,2024-10-01 00:00:00,10.0
1376,2218.0,2024-10-01 00:00:00,77.62
1377,2370.0,2024-10-01 00:00:00,144.59
1378,944.0,2024-10-01 00:00:00,20.05
1379,2661.0,2024-10-01 00:00:00,56.42
1380,349.0,2024-10-01 00:00:00,131.13
1381,1677.0,2024-10-01 00:00:00,10.0
1382,2788.0,2024-10-01 00:00:00,68.18
1383,667.0,01/10/2024 00:00:00,619.54
1384,2177.0,2024-10-01 00:00:00,10.0
1385,2653.0,2024-10-01 00:00:00,131.38
1386,980.0,2024-10-01 00:00:00,19.02
1387,1630.0,2024-10-01 00:00:00,501.25
1388,2766.0,2024-10-01 00:00:00,194.59
1389,685.0,2024-10-02 00:00:00,57.8
1390,2004.0,2024-10-02 00:00:00,170.59
1391,1106.0,2024-10-02 00:00:00,213.79
1392,2162.0,2024-10-02 00:00:00,465.04
1393,154.0,2024-10-02 00:00:00,500.79
1394,1290.0,2024-10-02 00:00:00,366.29
1395,1065.0,2024-10-02 00:00:00,10.0
1396,1914.0,2024-10-02 00:00:00,626.17
1397,2402.0,2024-10-02 00:00:00,227.61
1398,1961.0,2024-10-02 00:00:00,600.99
1399,709.0,2024-10-02 00:00:00,253.99
1400,2872.0,02/10/2024 00:00:00,173.54
1401,2147.0,2024-10-02 00:00:00,79.01
1402,2451.0,2024-10-02 00:00:00,31.05
1403,2247.0,2024-10-02 00:00:00,449.04
1404,2375.0,2024-10-02 00:00:00,373.97
1405,405.0,2024-10-03 00:00:00,288.03
1406,2839.0,2024-10-03 00:00:00,129.38
1407,1423.0,2024-10-03 00:00:00,157.27
1408,221.0,2024-10-03 00:00:00,58.96
1409,1392.0,2024-10-03 00:00:00,80.56
1410,615.0,2024-10-03 00:00:00,10.0
1411,475.0,2024-10-03 00:00:00,14.3
1412,271.0,2024-10-03 00:00:00,423.22
1413,1921.0,2024-10-03 00:00:00,105.33
1414,40.0,2024-10-03 00:00:00,10.0
1415,994.0,2024-10-03 00:00:00,297.36
1416,2584.0,2024-10-03 00:00:00,212.64
1417,290.0,2024-10-03 00:00:00,417.31
1418,2519.0,2024-10-03 00:00:00,10.0
1419,2676.0,2024-10-03 00:00:00,110.76
1420,581.0,2024-10-03 00:00:00,99.46
1421,181.0,2024-10-03 00:00:00,290.1
1422,825.0,2024-10-03 00:00:00,178.53
1423,700.0,2024-10-03 00:00:00,147.84
1424,1381.0,2024-10-03 00:00:00,256.84
1425,2728.0,2024-10-04 00:00:00,51.27
1426,1958.0,2024-10-04 00:00:00,10.0
1427,212.0,2024-10-04 00:00:00,52.38
1428,1715.0,2024-10-04 00:00:00,10.66
1429,1988.0,2024-10-04 00:00:00,681.32
1430,1535.0,2024-10-04 00:00:00,204.68
1431,1989.0,2024-10-04 00:00:00,284.65
1432,1850.0,2024-10-04 00:00:00,72.17
1433,2750.0,2024-10-04 00:00:00,340.78
1434,1136.0,2024-10-04 00:00:00,339.41
1435,206.0,2024-10-04 00:00:00,26.79
1436,496.0,2024-10-04 00:00:00,464.44
1437,1910.0,2024-10-04 00:00:00,104.09
1438,2552.0,2024-10-04 00:00:00,287.5
1439,310.0,2024-10-04 00:00:00,178.63
1440,2801.0,2024-10-05 00:00:00,95.83
1441,1823.0,2024-10-05 00:00:00,280.35
1442,2080.0,2024-10-05 00:00:00,36.62
1443,2815.0,2024-10-05 00:00:00,145.79
1444,977.0,2024-10-05 00:00:00,608.24
1445,10.0,2024-10-05 00:00:00,131.5
1446,2833.0,2024-10-05 00:00:00,184.04
1447,2484.0,2024-10-05 00:00:00,200.02
1448,1659.0,2024-10-05 00:00:00,284.6
1449,2801.0,2024-10-05 00:00:00,144.25
1450,1753.0,2024-10-05 00:00:00,37.77
1451,1105.0,2024-10-05 00:00:00,540.39
1452,1112.0,2024-10-05 00:00:00,34.64
1453,1915.0,2024-10-05 00:00:00,325.44
1454,1007.0,2024-10-05 00:00:00,237.22
1455,167.0,2024-10-05 00:00:00,380.05
1456,2361.0,2024-10-05 00:00:00,64.06
1457,763.0,2024-10-05 00:00:00,10.66
1458,2121.0,2024-10-05 00:00:00,84.73
1459,262.0,2024-10-05 00:00:00,218.81
1460,2293.0,2024-10-05 00:00:00,388.34
1461,561.0,2024-10-05 00:00:00,259.7
1462,175.0,2024-10-05 00:00:00,114.3
1463,192.0,2024-10-05 00:00:00,137.14
1464,1498.0,2024-10-05 00:00:00,35.59
1465,1568.0,2024-10-05 00:00:00,97.96
1466,1938.0,2024-10-05 00:00:00,10.0
1467,43.0,2024-10-05 00:00:00,365.27
1468,2536.0,2024-10-06 00:00:00,319.45
1469,1825.0,2024-10-06 00:00:00,703.03
1470,701.0,2024-10-06 00:00:00,20.52
1471,2776.0,2024-10-06 00:00:00,244.07
1472,902.0,2024-10-06 00:00:00,158.12
1473,1192.0,2024-10-06 00:00:00,10.61
1474,2241.0,2024-10-06 00:00:00,73.88
1475,390.0,2024-10-06 00:00:00,25.22
1476,1856.0,06/10/2024 00:00:00,250.64
1477,659.0,2024-10-06 00:00:00,101.02
1478,891.0,2024-10-06 00:00:00,422.96
1479,452.0,2024-10-06 00:00:00,196.18
1480,1538.0,2024-10-06 00:00:00,410.23
1481,883.0,2024-10-06 00:00:00,139.24
1482,840.0,2024-10-06 00:00:00,57.66
1483,375.0,2024-10-06 00:00:00,169.61
1484,595.0,2024-10-06 00:00:00,197.77
1485,500.0,2024-10-06 00:00:00,224.18
1486,113.0,2024-10-06 00:00:00,10.0
1487,2379.0,2024-10-06 00:00:00,42.5
1488,140.0,2024-10-06 00:00:00,194.2
1489,517.0,2024-10-06 00:00:00,263.88
1490,2894.0,2024-10-06 00:00:00,186.03
1491,888.0,2024-10-06 00:00:00,306.27
1492,1342.0,2024-10-06 00:00:00,17.53
1493,19.0,2024-10-06 00:00:00,226.36
1494,1474.0,06/10/2024 00:00:00,45.98
1495,452.0,2024-10-06 00:00:00,804.03
1496,1108.0,2024-10-06 00:00:00,222.63
1497,215.0,2024-10-07 00:00:00,44.38
1498,128.0,2024-10-07 00:00:00,278.01
1499,760.0,2024-10-07 00:00:00,928.4
1500,1816.0,2024-10-07 00:00:00,64.68
1501,2762.0,2024-10-07 00:00:00,492.39
1502,1416.0,2024-10-07 00:00:00,13.98
1503,1693.0,2024-10-07 00:00:00,755.36
1504,2370.0,2024-10-07 00:00:00,705.87
1505,1349.0,2024-10-07 00:00:00,772.24
1506,681.0,07/10/2024 00:00:00,267.79
1507,1492.0,2024-10-07 00:00:00,109.89
1508,1713.0,2024-10-07 00:00:00,101.37
1509,2435.0,2024-10-07 00:00:00,45.97
1510,1827.0,2024-10-07 00:00:00,62.54
1511,1660.0,2024-10-07 00:00:00,159.53
1512,2214.0,2024-10-07 00:00:00,691.79
1513,1963.0,2024-10-07 00:00:00,180.95
1514,219.0,2024-10-07 00:00:00,15.72
1515,2278.0,2024-10-07 00:00:00,14.16
1516,2601.0,2024-10-07 00:00:00,19.32
1517,403.0,2024-10-07 00:00:00,195.45
1518,2415.0,2024-10-07 00:00:00,161.21
1519,2850.0,2024-10-07 00:00:00,243.34
1520,1158.0,2024-10-07 00:00:00,57.77
1521,73.0,2024-10-08 00:00:00,245.26
1522,560.0,2024-10-08 00:00:00,175.2
1523,1467.0,2024-10-08 00:00:00,63.24
1524,2556.0,2024-10-08 00:00:00,10.0
1525,1089.0,2024-10-08 00:00:00,24.9
1526,2009.0,2024-10-08 00:00:00,33.64
1527,662.0,2024-10-08 00:00:00,559.56
1528,2965.0,2024-10-08 00:00:00,45.29
1529,1814.0,2024-10-08 00:00:00,196.28
1530,2462.0,2024-10-08 00:00:00,227.96
1531,284.0,2024-10-08 00:00:00,197.5
1532,301.0,2024-10-08 00:00:00,174.9
1533,817.0,2024-10-08 00:00:00,156.17
1534,83.0,2024-10-08 00:00:00,632.03
1535,2094.0,2024-10-08 00:00:00,41.78
1536,2310.0,2024-10-08 00:00:00,754.51
1537,2705.0,2024-10-08 00:00:00,137.85
1538,1819.0,2024-10-08 00:00:00,113.68
1539,1780.0,2024-10-08 00:00:00,275.97
1540,1433.0,2024-10-09 00:00:00,113.84
1541,644.0,2024-10-09 00:00:00,113.97
1542,73.0,2024-10-09 00:00:00,115.39
1543,2963.0,2024-10-09 00:00:00,178.05
1544,43.0,2024-10-09 00:00:00,203.05
1545,2218.0,2024-10-09 00:00:00,241.37
1546,1517.0,2024-10-09 00:00:00,19.17
1547,369.0,2024-10-09 00:00:00,341.16
1548,1135.0,2024-10-09 00:00:00,268.43
1549,1071.0,2024-10-09 00:00:00,10.0
1550,2785.0,2024-10-09 00:00:00,48.26
1551,69.0,2024-10-09 00:00:00,16.06
1552,802.0,2024-10-09 00:00:00,12.91
1553,61.0,2024-10-09 00:00:00,110.6
1554,1338.0,2024-10-09 00:00:00,181.81
1555,1552.0,2024-10-09 00:00:00,16.93
1556,1328.0,2024-10-09 00:00:00,81.0
1557,1362.0,2024-10-09 00:00:00,327.04
1558,275.0,2024-10-09 00:00:00,136.05
1559,2367.0,2024-10-09 00:00:00,157.16
1560,2435.0,2024-10-09 00:00:00,191.83
1561,2881.0,2024-10-10 00:00:00,58.43
1562,603.0,2024-10-10 00:00:00,147.4
1563,691.0,2024-10-10 00:00:00,294.58
1564,2769.0,2024-10-10 00:00:00,507.07
1565,390.0,2024-10-10 00:00:00,321.61
1566,295.0,2024-10-10 00:00:00,62.63
1567,2844.0,2024-10-10 00:00:00,493.63
1568,2597.0,2024-10-10 00:00:00,219.6
1569,568.0,2024-10-10 00:00:00,309.64
1570,2818.0,2024-10-10 00:00:00,198.98
1571,363.0,2024-10-10 00:00:00,203.2
1572,742.0,2024-10-10 00:00:00,111.58
1573,2468.0,2024-10-10 00:00:00,153.15
1574,1643.0,2024-10-10 00:00:00,550.65
1575,2140.0,2024-10-10 00:00:00,108.74
1576,63.0,2024-10-10 00:00:00,69.17
1577,1163.0,2024-10-10 00:00:00,182.68
1578,1229.0,2024-10-10 00:00:00,71.63
1579,256.0,2024-10-10 00:00:00,104.73
1580,875.0,2024-10-10 00:00:00,135.1
1581,823.0,2024-10-10 00:00:00,249.63
1582,2982.0,2024-10-11 00:00:00,212.94
1583,1638.0,2024-10-11 00:00:00,34.75
1584,1008.0,2024-10-11 00:00:00,145.31
1585,2033.0,2024-10-11 00:00:00,41.07
1586,2069.0,2024-10-11 00:00:00,274.7
1587,2669.0,2024-10-11 00:00:00,350.3
1588,803.0,2024-10-11 00:00:00,327.82
1589,1153.0,2024-10-11 00:00:00,74.16
1590,2331.0,2024-10-11 00:00:00,144.72
1591,1689.0,2024-10-11 00:00:00,88.29
1592,1914.0,2024-10-11 00:00:00,352.7
1593,2201.0,2024-10-11 00:00:00,352.19
1594,1838.0,2024-10-11 00:00:00,490.19
1595,1572.0,2024-10-11 00:00:00,200.05
1596,1201.0,2024-10-11 00:00:00,140.9
1597,2855.0,2024-10-11 00:00:00,52.74
1598,2929.0,2024-10-11 00:00:00,21.64
1599,137.0,2024-10-11 00:00:00,16.16
1600,2157.0,2024-10-11 00:00:00,139.89
1601,662.0,2024-10-11 00:00:00,147.46
1602,2309.0,2024-10-11 00:00:00,225.98
1603,2513.0,2024-10-11 00:00:00,84.56
1604,2462.0,2024-10-11 00:00:00,115.68
1605,2774.0,2024-10-11 00:00:00,70.18
1606,1701.0,2024-10-11 00:00:00,105.9
1607,2720.0,2024-10-11 00:00:00,236.8
1608,495.0,2024-10-11 00:00:00,134.42
1609,1069.0,2024-10-12 00:00:00,36.13
1610,597.0,2024-10-12 00:00:00,253.69
1611,646.0,2024-10-12 00:00:00,311.59
1612,1630.0,2024-10-12 00:00:00,35.2
1613,289.0,2024-10-12 00:00:00,84.69
1614,638.0,2024-10-12 00:00:00,36.24
1615,2986.0,2024-10-12 00:00:00,426.84
1616,634.0,2024-10-12 00:00:00,87.48
1617,115.0,2024-10-12 00:00:00,50.3
1618,1737.0,2024-10-12 00:00:00,47.62
1619,2254.0,12/10/2024 00:00:00,36.53
1620,2806.0,2024-10-12 00:00:00,62.29
1621,2166.0,2024-10-12 00:00:00,49.58
1622,412.0,2024-10-12 00:00:00,169.69
1623,2411.0,2024-10-12 00:00:00,162.78
1624,19.0,2024-10-12 00:00:00,227.25
1625,1960.0,2024-10-12 00:00:00,242.23
1626,449.0,2024-10-13 00:00:00,45.55
1627,1378.0,2024-10-13 00:00:00,106.19
1628,2806.0,2024-10-13 00:00:00,171.33
1629,93.0,2024-10-13 00:00:00,152.07
1630,205.0,2024-10-13 00:00:00,238.56
1631,245.0,2024-10-13 00:00:00,24.93
1632,2973.0,2024-10-13 00:00:00,115.64
1633,856.0,2024-10-13 00:00:00,235.58
1634,71.0,2024-10-13 00:00:00,24.27
1635,305.0,2024-10-13 00:00:00,227.2
1636,1338.0,2024-10-13 00:00:00,141.78
1637,821.0,2024-10-13 00:00:00,299.66
1638,529.0,2024-10-13 00:00:00,389.41
1639,251.0,2024-10-13 00:00:00,128.59
1640,2589.0,2024-10-13 00:00:00,198.0
1641,2464.0,2024-10-13 00:00:00,250.8
1642,1168.0,2024-10-13 00:00:00,10.0
1643,2716.0,2024-10-13 00:00:00,238.99
1644,1848.0,2024-10-13 00:00:00,361.72
1645,505.0,2024-10-13 00:00:00,414.57
1646,2473.0,2024-10-13 00:00:00,132.75
1647,2995.0,2024-10-13 00:00:00,67.24
1648,1223.0,2024-10-14 00:00:00,120.04
1649,339.0,2024-10-14 00:00:00,343.63
1650,429.0,2024-10-14 00:00:00,132.46
1651,139.0,2024-10-14 00:00:00,15.74
1652,542.0,2024-10-14 00:00:00,208.7
1653,2706.0,2024-10-14 00:00:00,464.1
1654,2608.0,2024-10-14 00:00:00,46.63
1655,2582.0,2024-10-14 00:00:00,130.5
1656,2799.0,2024-10-14 00:00:00,156.07
1657,2340.0,2024-10-14 00:00:00,376.68
1658,2164.0,2024-10-14 00:00:00,209.01
1659,685.0,2024-10-14 00:00:00,119.74
1660,2381.0,2024-10-14 00:00:00,325.74
1661,2383.0,14/10/2024 00:00:00,52.68
1662,221.0,2024-10-14 00:00:00,163.77
1663,2371.0,2024-10-14 00:00:00,49.72
1664,1718.0,2024-10-14 00:00:00,261.3
1665,40.0,2024-10-14 00:00:00,14.24
1666,2622.0,2024-10-14 00:00:00,93.83
1667,1908.0,2024-10-14 00:00:00,10.0
1668,2667.0,2024-10-15 00:00:00,529.83
1669,898.0,2024-10-15 00:00:00,216.76
1670,2609.0,2024-10-15 00:00:00,93.44
1671,671.0,2024-10-15 00:00:00,326.43
1672,2365.0,2024-10-15 00:00:00,21.89
1673,1072.0,2024-10-15 00:00:00,13.76
1674,1160.0,2024-10-15 00:00:00,111.05
1675,2362.0,2024-10-15 00:00:00,304.62
1676,1854.0,2024-10-15 00:00:00,324.91
1677,2533.0,2024-10-15 00:00:00,46.45
1678,44.0,2024-10-15 00:00:00,271.16
1679,583.0,2024-10-15 00:00:00,217.23
1680,2943.0,2024-10-15 00:00:00,442.2
1681,2973.0,2024-10-15 00:00:00,34.56
1682,2775.0,2024-10-15 00:00:00,185.98
1683,1813.0,2024-10-15 00:00:00,212.34
1684,804.0,2024-10-15 00:00:00,382.9
1685,1781.0,15/10/2024 00:00:00,200.15
1686,2986.0,2024-10-15 00:00:00,73.32
1687,2315.0,2024-10-15 00:00:00,63.2
1688,616.0,2024-10-15 00:00:00,75.33
1689,955.0,2024-10-15 00:00:00,395.4
1690,2782.0,2024-10-15 00:00:00,476.84
1691,2348.0,2024-10-15 00:00:00,273.89
1692,1360.0,2024-10-15 00:00:00,16.02
1693,2562.0,2024-10-15 00:00:00,28.69
1694,371.0,2024-10-15 00:00:00,345.0
1695,658.0,2024-10-15 00:00:00,636.4
1696,1393.0,2024-10-15 00:00:00,63.48
1697,2553.0,2024-10-16 00:00:00,61.32
1698,2726.0,16/10/2024 00:00:00,275.85
1699,2109.0,2024-10-16 00:00:00,78.46
1700,2733.0,2024-10-16 00:00:00,349.65
1701,923.0,2024-10-16 00:00:00,180.92
1702,1610.0,2024-10-16 00:00:00,216.92
1703,975.0,2024-10-16 00:00:00,344.8
1704,1815.0,2024-10-16 00:00:00,818.54
1705,2008.0,2024-10-16 00:00:00,18.51
1706,2388.0,2024-10-16 00:00:00,91.88
1707,392.0,2024-10-16 00:00:00,10.0
1708,2623.0,2024-10-16 00:00:00,61.31
1709,2941.0,2024-10-16 00:00:00,422.7
1710,1615.0,2024-10-16 00:00:00,162.99
1711,1838.0,2024-10-16 00:00:00,219.83
1712,2950.0,2024-10-16 00:00:00,112.07
1713,366.0,2024-10-16 00:00:00,438.06
1714,455.0,2024-10-16 00:00:00,1112.34
1715,230.0,2024-10-16 00:00:00,19.82
1716,2379.0,2024-10-16 00:00:00,335.02
1717,893.0,2024-10-16 00:00:00,13.92
1718,2736.0,2024-10-16 00:00:00,350.49
1719,1676.0,2024-10-17 00:00:00,79.09
1720,2847.0,2024-10-17 00:00:00,323.24
1721,2621.0,2024-10-17 00:00:00,390.42
1722,365.0,2024-10-17 00:00:00,125.41
1723,351.0,2024-10-17 00:00:00,10.0
1724,2301.0,2024-10-17 00:00:00,76.58
1725,2851.0,2024-10-17 00:00:00,10.0
1726,2965.0,2024-10-17 00:00:00,306.25
1727,1995.0,2024-10-17 00:00:00,10.0
1728,508.0,2024-10-17 00:00:00,212.46
1729,2851.0,2024-10-17 00:00:00,10.0
1730,2510.0,2024-10-17 00:00:00,496.83
1731,992.0,2024-10-17 00:00:00,73.91
1732,2255.0,2024-10-17 00:00:00,143.34
1733,515.0,2024-10-17 00:00:00,195.96
1734,2186.0,17/10/2024 00:00:00,99.05
1735,68.0,2024-10-17 00:00:00,935.1
1736,383.0,2024-10-17 00:00:00,264.1
1737,2122.0,2024-10-17 00:00:00,29.8
1738,1300.0,2024-10-17 00:00:00,168.55
1739,2903.0,2024-10-17 00:00:00,526.72
1740,1646.0,2024-10-17 00:00:00,92.88
1741,2588.0,2024-10-17 00:00:00,150.02
1742,1339.0,2024-10-17 00:00:00,126.71
1743,1685.0,2024-10-17 00:00:00,793.91
1744,1924.0,2024-10-17 00:00:00,394.72
1745,2218.0,2024-10-17 00:00:00,251.12
1746,1945.0,2024-10-17 00:00:00,140.24
1747,288.0,2024-10-17 00:00:00,121.31
1748,2962.0,2024-10-17 00:00:00,90.02
1749,2742.0,2024-10-18 00:00:00,93.4
1750,2519.0,2024-10-18 00:00:00,518.18
1751,940.0,2024-10-18 00:00:00,138.77
1752,1449.0,2024-10-18 00:00:00,206.71
1753,2905.0,2024-10-18 00:00:00,209.19
1754,2506.0,2024-10-18 00:00:00,161.8
1755,833.0,2024-10-18 00:00:00,202.09
1756,2241.0,2024-10-18 00:00:00,39.53
1757,406.0,2024-10-18 00:00:00,121.46
1758,2991.0,2024-10-18 00:00:00,120.63
1759,2478.0,2024-10-18 00:00:00,37.2
1760,434.0,2024-10-18 00:00:00,302.01
1761,375.0,2024-10-18 00:00:00,37.61
1762,207.0,2024-10-18 00:00:00,364.22
1763,1142.0,2024-10-18 00:00:00,231.48
1764,2214.0,2024-10-18 00:00:00,153.55
1765,90.0,2024-10-19 00:00:00,102.8
1766,1858.0,2024-10-19 00:00:00,170.01
1767,2790.0,2024-10-19 00:00:00,205.77
1768,1611.0,2024-10-19 00:00:00,179.71
1769,1960.0,2024-10-19 00:00:00,180.32
1770,2708.0,2024-10-19 00:00:00,10.0
1771,296.0,2024-10-19 00:00:00,52.48
1772,640.0,2024-10-19 00:00:00,191.59
1773,2487.0,2024-10-19 00:00:00,428.97
1774,830.0,2024-10-19 00:00:00,181.65
1775,976.0,2024-10-19 00:00:00,397.55
1776,1263.0,2024-10-19 00:00:00,230.06
1777,2203.0,2024-10-19 00:00:00,267.44
1778,2136.0,2024-10-19 00:00:00,431.84
1779,1097.0,2024-10-19 00:00:00,1178.35
1780,2260.0,2024-10-19 00:00:00,48.73
1781,465.0,2024-10-19 00:00:00,194.91
1782,2679.0,2024-10-19 00:00:00,192.99
1783,1231.0,2024-10-19 00:00:00,375.97
1784,2414.0,2024-10-19 00:00:00,81.68
1785,1333.0,2024-10-19 00:00:00,740.54
1786,945.0,19/10/2024 00:00:00,221.31
1787,2858.0,2024-10-19 00:00:00,556.01
1788,1939.0,2024-10-20 00:00:00,160.54
1789,1970.0,2024-10-20 00:00:00,107.65
1790,2618.0,2024-10-20 00:00:00,52.11
1791,2324.0,2024-10-20 00:00:00,11.36
1792,2776.0,2024-10-20 00:00:00,21.29
1793,564.0,20/10/2024 00:00:00,115.41
1794,2041.0,2024-10-20 00:00:00,686.92
1795,1320.0,2024-10-20 00:00:00,10.0
1796,1943.0,2024-10-20 00:00:00,320.19
1797,110.0,2024-10-20 00:00:00,199.16
1798,1117.0,2024-10-20 00:00:00,52.92
1799,1084.0,2024-10-20 00:00:00,350.45
1800,637.0,2024-10-20 00:00:00,72.04
1801,36.0,2024-10-20 00:00:00,47.27
1802,1362.0,2024-10-20 00:00:00,83.91
1803,2431.0,2024-10-20 00:00:00,864.44
1804,2838.0,2024-10-20 00:00:00,132.54
1805,11.0,2024-10-20 00:00:00,165.75
1806,2144.0,2024-10-20 00:00:00,33.92
1807,2240.0,2024-10-20 00:00:00,173.83
1808,1448.0,2024-10-20 00:00:00,72.37
1809,1944.0,2024-10-20 00:00:00,195.63
1810,1852.0,2024-10-20 00:00:00,133.82
1811,2783.0,2024-10-20 00:00:00,73.19
1812,825.0,2024-10-20 00:00:00,251.18
1813,2229.0,21/10/2024 00:00:00,108.47
1814,777.0,2024-10-21 00:00:00,42.32
1815,1113.0,2024-10-21 00:00:00,170.8
1816,972.0,2024-10-21 00:00:00,300.16
1817,1423.0,2024-10-21 00:00:00,44.44
1818,1999.0,2024-10-21 00:00:00,154.45
1819,679.0,21/10/2024 00:00:00,165.36
1820,2441.0,2024-10-21 00:00:00,564.08
1821,1106.0,2024-10-21 00:00:00,127.3
1822,2249.0,2024-10-21 00:00:00,135.68
1823,1235.0,2024-10-21 00:00:00,214.64
1824,2809.0,2024-10-21 00:00:00,392.93
1825,2960.0,2024-10-21 00:00:00,79.57
1826,187.0,2024-10-21 00:00:00,287.47
1827,2878.0,2024-10-21 00:00:00,467.22
1828,2925.0,2024-10-21 00:00:00,605.01
1829,1253.0,2024-10-21 00:00:00,142.73
1830,1613.0,2024-10-22 00:00:00,173.17
1831,1882.0,2024-10-22 00:00:00,407.44
1832,310.0,2024-10-22 00:00:00,52.23
1833,1575.0,2024-10-22 00:00:00,538.6
1834,2893.0,2024-10-22 00:00:00,216.75
1835,2534.0,2024-10-22 00:00:00,28.23
1836,2168.0,22/10/2024 00:00:00,40.98
1837,1758.0,2024-10-22 00:00:00,385.19
1838,1667.0,2024-10-22 00:00:00,40.38
1839,2786.0,2024-10-22 00:00:00,467.0
1840,2656.0,2024-10-22 00:00:00,523.8
1841,2760.0,2024-10-22 00:00:00,163.64
1842,1854.0,2024-10-22 00:00:00,30.86
1843,1230.0,2024-10-22 00:00:00,58.28
1844,2954.0,2024-10-22 00:00:00,91.58
1845,699.0,2024-10-22 00:00:00,82.34
1846,827.0,2024-10-22 00:00:00,373.02
1847,1279.0,22/10/2024 00:00:00,82.39
1848,308.0,2024-10-22 00:00:00,223.42
1849,1961.0,22/10/2024 00:00:00,58.24
1850,725.0,2024-10-22 00:00:00,414.41
1851,383.0,2024-10-22 00:00:00,61.1
1852,525.0,2024-10-22 00:00:00,195.36
1853,2986.0,2024-10-22 00:00:00,314.62
1854,276.0,2024-10-23 00:00:00,94.49
1855,337.0,2024-10-23 00:00:00,32.99
1856,481.0,2024-10-23 00:00:00,161.64
1857,1997.0,2024-10-23 00:00:00,19.69
1858,1352.0,2024-10-23 00:00:00,507.0
1859,109.0,23/10/2024 00:00:00,578.87
1860,328.0,2024-10-23 00:00:00,46.52
1861,1135.0,2024-10-23 00:00:00,478.14
1862,1521.0,2024-10-23 00:00:00,296.14
1863,1725.0,2024-10-23 00:00:00,33.56
1864,2806.0,2024-10-23 00:00:00,112.42
1865,913.0,2024-10-23 00:00:00,243.54
1866,13.0,2024-10-23 00:00:00,293.46
1867,1757.0,2024-10-23 00:00:00,246.28
1868,2829.0,2024-10-23 00:00:00,224.42
1869,2654.0,2024-10-23 00:00:00,45.74
1870,1591.0,2024-10-23 00:00:00,208.03
1871,1491.0,2024-10-23 00:00:00,190.97
1872,1225.0,23/10/2024 00:00:00,126.35
1873,2527.0,2024-10-23 00:00:00,26.34
1874,2432.0,2024-10-23 00:00:00,10.0
1875,417.0,2024-10-23 00:00:00,383.44
1876,2697.0,2024-10-23 00:00:00,365.49
1877,1068.0,2024-10-24 00:00:00,10.0
1878,1122.0,24/10/2024 00:00:00,48.54
1879,1807.0,2024-10-24 00:00:00,125.35
1880,1017.0,2024-10-24 00:00:00,187.46
1881,72.0,2024-10-24 00:00:00,511.15
1882,1292.0,2024-10-24 00:00:00,95.53
1883,883.0,2024-10-24 00:00:00,277.88
1884,2911.0,2024-10-24 00:00:00,296.36
1885,2464.0,2024-10-24 00:00:00,162.59
1886,1749.0,2024-10-24 00:00:00,166.84
1887,1592.0,2024-10-24 00:00:00,97.98
1888,946.0,2024-10-24 00:00:00,76.56
1889,493.0,2024-10-24 00:00:00,350.73
1890,822.0,2024-10-24 00:00:00,18.32
1891,1969.0,2024-10-24 00:00:00,53.43
1892,2187.0,2024-10-24 00:00:00,69.21
1893,1474.0,2024-10-24 00:00:00,220.44
1894,1875.0,2024-10-24 00:00:00,202.72
1895,2043.0,24/10/2024 00:00:00,189.07
1896,2232.0,2024-10-24 00:00:00,76.41
1897,1574.0,2024-10-24 00:00:00,588.1
1898,2225.0,2024-10-24 00:00:00,66.15
1899,2106.0,2024-10-24 00:00:00,121.62
1900,977.0,2024-10-25 00:00:00,245.0
1901,1271.0,2024-10-25 00:00:00,114.41
1902,2131.0,2024-10-25 00:00:00,74.76
1903,1379.0,2024-10-25 00:00:00,30.69
1904,1720.0,2024-10-25 00:00:00,116.97
1905,897.0,2024-10-25 00:00:00,18.64
1906,2864.0,2024-10-25 00:00:00,359.84
1907,2495.0,2024-10-25 00:00:00,837.89
1908,472.0,2024-10-25 00:00:00,93.21
1909,2948.0,2024-10-25 00:00:00,44.25
1910,923.0,2024-10-25 00:00:00,19.38
1911,2960.0,2024-10-25 00:00:00,247.67
1912,2520.0,25/10/2024 00:00:00,83.54
1913,2797.0,2024-10-25 00:00:00,118.38
1914,2850.0,2024-10-25 00:00:00,41.99
1915,2968.0,2024-10-25 00:00:00,127.34
1916,1097.0,2024-10-25 00:00:00,278.2
1917,152.0,2024-10-25 00:00:00,340.1
1918,1978.0,2024-10-25 00:00:00,567.86
1919,271.0,2024-10-25 00:00:00,124.12
1920,105.0,2024-10-25 00:00:00,217.85
1921,1711.0,2024-10-25 00:00:00,102.97
1922,2399.0,2024-10-25 00:00:00,88.25
1923,140.0,2024-10-25 00:00:00,479.76
1924,87.0,2024-10-25 00:00:00,71.01
1925,2416.0,2024-10-25 00:00:00,63.39
1926,1602.0,2024-10-25 00:00:00,40.82
1927,149.0,2024-10-25 00:00:00,112.41
1928,1457.0,2024-10-25 00:00:00,345.75
1929,1493.0,2024-10-25 00:00:00,265.55
1930,884.0,26/10/2024 00:00:00,67.92
1931,250.0,2024-10-26 00:00:00,29.49
1932,975.0,2024-10-26 00:00:00,113.78
1933,2837.0,2024-10-26 00:00:00,175.22
1934,2938.0,2024-10-26 00:00:00,158.24
1935,2673.0,2024-10-26 00:00:00,10.0
1936,1327.0,2024-10-26 00:00:00,10.0
1937,91.0,2024-10-26 00:00:00,536.34
1938,739.0,2024-10-26 00:00:00,167.22
1939,1687.0,2024-10-26 00:00:00,240.59
1940,2186.0,2024-10-26 00:00:00,79.14
1941,1009.0,2024-10-26 00:00:00,17.27
1942,203.0,2024-10-26 00:00:00,322.87
1943,2053.0,2024-10-26 00:00:00,20.79
1944,1717.0,2024-10-26 00:00:00,124.72
1945,2104.0,2024-10-26 00:00:00,19.34
1946,870.0,2024-10-26 00:00:00,48.34
1947,585.0,2024-10-26 00:00:00,452.09
1948,1538.0,2024-10-26 00:00:00,268.54
1949,1724.0,2024-10-26 00:00:00,191.91
1950,1803.0,2024-10-26 00:00:00,151.98
1951,844.0,2024-10-26 00:00:00,412.89
1952,2765.0,2024-10-26 00:00:00,167.85
1953,1983.0,2024-10-27 00:00:00,164.77
1954,2941.0,2024-10-27 00:00:00,341.56
1955,606.0,2024-10-27 00:00:00,60.13
1956,2746.0,2024-10-27 00:00:00,112.86
1957,674.0,2024-10-27 00:00:00,10.33
1958,1588.0,2024-10-27 00:00:00,10.0
1959,897.0,2024-10-27 00:00:00,122.47
1960,552.0,2024-10-27 00:00:00,909.98
1961,2433.0,2024-10-27 00:00:00,58.3
1962,2742.0,2024-10-27 00:00:00,456.05
1963,1359.0,2024-10-27 00:00:00,343.73
1964,678.0,2024-10-27 00:00:00,452.45
1965,1232.0,2024-10-27 00:00:00,90.06
1966,1809.0,2024-10-27 00:00:00,79.55
1967,2650.0,2024-10-27 00:00:00,33.93
1968,166.0,2024-10-27 00:00:00,125.73
1969,590.0,2024-10-28 00:00:00,488.12
1970,163.0,2024-10-28 00:00:00,50.01
1971,1263.0,2024-10-28 00:00:00,30.07
1972,655.0,2024-10-28 00:00:00,347.03
1973,269.0,2024-10-28 00:00:00,122.91
1974,1269.0,2024-10-28 00:00:00,45.69
1975,1084.0,2024-10-28 00:00:00,25.26
1976,982.0,2024-10-28 00:00:00,15.93
1977,407.0,2024-10-28 00:00:00,151.67
1978,2074.0,2024-10-28 00:00:00,553.27
1979,986.0,2024-10-28 00:00:00,104.76
1980,710.0,2024-10-28 00:00:00,212.36
1981,754.0,2024-10-28 00:00:00,709.14
1982,2833.0,2024-10-28 00:00:00,526.5
1983,1486.0,2024-10-28 00:00:00,14.18
1984,2432.0,2024-10-28 00:00:00,54.66
1985,19.0,2024-10-28 00:00:00,297.07
1986,2799.0,2024-10-28 00:00:00,216.81
1987,2467.0,2024-10-28 00:00:00,87.6
1988,1636.0,28/10/2024 00:00:00,228.73
1989,2170.0,2024-10-28 00:00:00,358.73
1990,1896.0,2024-10-28 00:00:00,77.03
1991,2429.0,2024-10-28 00:00:00,93.51
1992,2411.0,2024-10-28 00:00:00,655.41
1993,2403.0,2024-10-28 00:00:00,87.67
1994,2874.0,2024-10-28 00:00:00,154.34
1995,1957.0,2024-10-28 00:00:00,14.54
1996,1775.0,2024-10-28 00:00:00,67.94
1997,808.0,2024-10-28 00:00:00,34.11
1998,732.0,2024-10-29 00:00:00,475.57
1999,1412.0,29/10/2024 00:00:00,108.66
2000,1308.0,2024-10-29 00:00:00,146.08
2001,1218.0,2024-10-29 00:00:00,162.86
2002,758.0,2024-10-29 00:00:00,76.46
2003,171.0,2024-10-29 00:00:00,60.86
2004,1581.0,2024-10-29 00:00:00,362.19
2005,2631.0,2024-10-29 00:00:00,544.54
2006,2419.0,2024-10-29 00:00:00,95.48
2007,1149.0,2024-10-29 00:00:00,198.75
2008,2846.0,2024-10-29 00:00:00,279.19
2009,658.0,2024-10-29 00:00:00,10.0
2010,2781.0,2024-10-29 00:00:00,101.58
2011,171.0,2024-10-29 00:00:00,448.1
2012,2711.0,2024-10-29 00:00:00,357.87
2013,1976.0,2024-10-29 00:00:00,372.44
2014,2542.0,2024-10-29 00:00:00,22.77
2015,2967.0,2024-10-29 00:00:00,138.82
2016,1642.0,2024-10-29 00:00:00,371.85
2017,1448.0,2024-10-29 00:00:00,158.58
2018,457.0,2024-10-29 00:00:00,73.77
2019,1236.0,2024-10-29 00:00:00,48.47
2020,2424.0,2024-10-29 00:00:00,10.0
2021,835.0,2024-10-29 00:00:00,352.62
2022,811.0,2024-10-29 00:00:00,766.59
2023,1412.0,2024-10-29 00:00:00,78.41
2024,2897.0,2024-10-29 00:00:00,260.66
2025,2464.0,2024-10-29 00:00:00,222.4
2026,2502.0,2024-10-30 00:00:00,116.17
2027,1217.0,30/10/2024 00:00:00,102.24
2028,1904.0,2024-10-30 00:00:00,193.17
2029,973.0,2024-10-30 00:00:00,927.79
2030,1539.0,2024-10-30 00:00:00,1208.37
2031,2124.0,2024-10-30 00:00:00,215.47
2032,225.0,2024-10-30 00:00:00,112.77
2033,2299.0,2024-10-30 00:00:00,557.84
2034,1815.0,2024-10-30 00:00:00,13.59
2035,125.0,2024-10-30 00:00:00,50.38
2036,2932.0,2024-10-30 00:00:00,158.13
2037,30.0,2024-10-30 00:00:00,299.48
2038,2018.0,2024-10-30 00:00:00,37.49
2039,2416.0,2024-10-30 00:00:00,116.77
2040,1610.0,2024-10-30 00:00:00,456.49
2041,1017.0,2024-10-30 00:00:00,234.5
2042,606.0,2024-10-30 00:00:00,21.13
2043,1961.0,2024-10-30 00:00:00,10.76
2044,116.0,2024-10-30 00:00:00,81.78
2045,1802.0,2024-10-30 00:00:00,53.27
2046,1547.0,2024-10-30 00:00:00,354.57
2047,685.0,2024-10-30 00:00:00,72.65
2048,1472.0,2024-10-30 00:00:00,65.67
2049,2306.0,2024-10-30 00:00:00,522.0
2050,810.0,2024-10-30 00:00:00,523.23
2051,1355.0,2024-10-30 00:00:00,108.95
2052,1779.0,2024-10-31 00:00:00,99.81
2053,1013.0,2024-10-31 00:00:00,262.73
2054,2704.0,2024-10-31 00:00:00,10.0
2055,1388.0,2024-10-31 00:00:00,75.29
2056,239.0,2024-10-31 00:00:00,10.0
2057,76.0,2024-10-31 00:00:00,90.55
2058,1924.0,2024-10-31 00:00:00,728.4
2059,2690.0,2024-10-31 00:00:00,12.78
2060,2331.0,2024-10-31 00:00:00,166.98
2061,2120.0,2024-10-31 00:00:00,469.19
2062,1903.0,2024-10-31 00:00:00,143.97
2063,575.0,2024-10-31 00:00:00,10.38
2064,2060.0,2024-10-31 00:00:00,105.69
2065,17.0,2024-10-31 00:00:00,50.15
2066,465.0,2024-10-31 00:00:00,51.26
2067,520.0,2024-10-31 00:00:00,532.99
2068,720.0,2024-10-31 00:00:00,42.95
2069,630.0,2024-10-31 00:00:00,82.33
2070,76.0,2024-10-31 00:00:00,67.75
2071,2448.0,2024-10-31 00:00:00,80.69
2072,1095.0,2024-10-31 00:00:00,10.53
2073,1405.0,2024-10-31 00:00:00,116.72
2074,195.0,2024-10-31 00:00:00,132.48
2075,1460.0,2024-10-31 00:00:00,35.2
2076,618.0,2024-10-31 00:00:00,46.79
2077,2213.0,2024-10-31 00:00:00,285.56
2078,285.0,2024-10-31 00:00:00,32.33
2079,838.0,2024-10-31 00:00:00,85.1
2080,2966.0,2024-11-01 00:00:00,26.84
2081,950.0,2024-11-01 00:00:00,10.0
2082,45.0,2024-11-01 00:00:00,82.36
2083,2082.0,2024-11-01 00:00:00,42.99
2084,830.0,2024-11-01 00:00:00,746.21
2085,1892.0,2024-11-01 00:00:00,434.46
2086,1391.0,2024-11-01 00:00:00,70.56
2087,1939.0,2024-11-01 00:00:00,208.88
2088,2287.0,2024-11-01 00:00:00,312.63
2089,148.0,2024-11-01 00:00:00,223.62
2090,388.0,2024-11-01 00:00:00,22.32
2091,916.0,01/11/2024 00:00:00,213.65
2092,278.0,2024-11-01 00:00:00,222.5
2093,1826.0,2024-11-01 00:00:00,10.0
2094,2697.0,2024-11-01 00:00:00,33.97
2095,2183.0,2024-11-01 00:00:00,24.95
2096,490.0,2024-11-01 00:00:00,315.8
2097,384.0,2024-11-01 00:00:00,286.82
2098,1877.0,01/11/2024 00:00:00,402.13
2099,1363.0,2024-11-01 00:00:00,842.28
2100,288.0,2024-11-01 00:00:00,193.2
2101,1908.0,2024-11-01 00:00:00,118.28
2102,2242.0,2024-11-01 00:00:00,80.18
2103,1888.0,2024-11-02 00:00:00,380.19
2104,2471.0,2024-11-02 00:00:00,544.94
2105,2177.0,2024-11-02 00:00:00,27.66
2106,341.0,2024-11-02 00:00:00,302.39
2107,1434.0,2024-11-02 00:00:00,148.3
2108,908.0,2024-11-02 00:00:00,10.0
2109,1372.0,2024-11-02 00:00:00,43.38
2110,559.0,2024-11-02 00:00:00,47.23
2111,2666.0,2024-11-02 00:00:00,313.53
2112,1642.0,2024-11-02 00:00:00,401.33
2113,1132.0,2024-11-02 00:00:00,12.59
2114,818.0,2024-11-02 00:00:00,224.07
2115,2541.0,2024-11-02 00:00:00,29.02
2116,195.0,2024-11-02 00:00:00,225.7
2117,2929.0,2024-11-02 00:00:00,576.22
2118,656.0,2024-11-02 00:00:00,10.0
2119,2742.0,2024-11-02 00:00:00,112.1
2120,1120.0,2024-11-02 00:00:00,51.31
2121,444.0,2024-11-02 00:00:00,573.16
2122,1761.0,2024-11-02 00:00:00,196.34
2123,1385.0,2024-11-02 00:00:00,211.25
2124,2351.0,2024-11-02 00:00:00,12.36
2125,1261.0,2024-11-02 00:00:00,186.28
2126,468.0,2024-11-02 00:00:00,241.72
2127,1307.0,2024-11-02 00:00:00,264.97
2128,2210.0,2024-11-02 00:00:00,40.53
2129,2060.0,2024-11-02 00:00:00,80.68
2130,588.0,2024-11-03 00:00:00,10.0
2131,522.0,2024-11-03 00:00:00,17.02
2132,1712.0,2024-11-03 00:00:00,10.0
2133,60.0,03/11/2024 00:00:00,300.53
2134,1459.0,2024-11-03 00:00:00,158.88
2135,2038.0,2024-11-03 00:00:00,70.18
2136,1695.0,2024-11-03 00:00:00,327.49
2137,527.0,2024-11-03 00:00:00,442.15
2138,2173.0,2024-11-03 00:00:00,10.0
2139,2965.0,2024-11-03 00:00:00,14.38
2140,2894.0,2024-11-03 00:00:00,366.29
2141,1752.0,2024-11-03 00:00:00,-9.14
2142,2040.0,2024-11-03 00:00:00,381.56
2143,1709.0,2024-11-03 00:00:00,69.44
2144,2254.0,2024-11-03 00:00:00,307.21
2145,1380.0,2024-11-03 00:00:00,186.02
2146,1120.0,2024-11-03 00:00:00,225.63
2147,164.0,2024-11-04 00:00:00,190.64
2148,2342.0,2024-11-04 00:00:00,70.15
2149,480.0,2024-11-04 00:00:00,282.39
2150,1424.0,2024-11-04 00:00:00,49.15
2151,2709.0,2024-11-04 00:00:00,200.87
2152,1486.0,2024-11-04 00:00:00,116.81
2153,710.0,2024-11-04 00:00:00,230.8
2154,1361.0,2024-11-04 00:00:00,218.76
2155,2365.0,2024-11-04 00:00:00,83.93
2156,1824.0,2024-11-04 00:00:00,335.79
2157,681.0,2024-11-04 00:00:00,123.49
2158,556.0,2024-11-04 00:00:00,209.84
2159,2157.0,2024-11-04 00:00:00,449.36
2160,2903.0,2024-11-04 00:00:00,261.08
2161,1915.0,2024-11-04 00:00:00,70.99
2162,43.0,2024-11-04 00:00:00,10.0
2163,1379.0,2024-11-04 00:00:00,88.2
2164,83.0,2024-11-04 00:00:00,32.08
2165,2238.0,2024-11-04 00:00:00,155.44
2166,936.0,2024-11-04 00:00:00,449.63
2167,2339.0,2024-11-04 00:00:00,458.11
2168,326.0,2024-11-04 00:00:00,334.54
2169,1986.0,2024-11-04 00:00:00,186.86
2170,508.0,2024-11-04 00:00:00,51.17
2171,2120.0,2024-11-04 00:00:00,19.96
2172,2988.0,2024-11-04 00:00:00,20.33
2173,1959.0,2024-11-04 00:00:00,873.8
2174,1368.0,2024-11-04 00:00:00,103.75
2175,2102.0,2024-11-04 00:00:00,413.69
2176,2659.0,04/11/2024 00:00:00,443.87
2177,1987.0,2024-11-05 00:00:00,334.77
2178,2106.0,2024-11-05 00:00:00,129.43
2179,129.0,05/11/2024 00:00:00,103.07
2180,852.0,2024-11-05 00:00:00,229.26
2181,2077.0,2024-11-05 00:00:00,237.26
2182,2179.0,2024-11-05 00:00:00,268.27
2183,2757.0,2024-11-05 00:00:00,172.78
2184,2260.0,2024-11-05 00:00:00,241.2
2185,1703.0,2024-11-05 00:00:00,412.49
2186,2733.0,2024-11-05 00:00:00,303.14
2187,1933.0,2024-11-05 00:00:00,10.0
2188,1110.0,2024-11-05 00:00:00,73.5
2189,2159.0,2024-11-05 00:00:00,192.0
2190,1067.0,2024-11-05 00:00:00,43.69
2191,2036.0,2024-11-05 00:00:00,160.17
2192,858.0,2024-11-05 00:00:00,22.87
2193,1050.0,2024-11-05 00:00:00,70.79
2194,924.0,2024-11-05 00:00:00,295.25
2195,2488.0,2024-11-05 00:00:00,11.74
2196,1575.0,2024-11-06 00:00:00,741.6
2197,1231.0,2024-11-06 00:00:00,157.2
2198,1803.0,2024-11-06 00:00:00,203.1
2199,411.0,2024-11-06 00:00:00,539.26
2200,2658.0,2024-11-06 00:00:00,137.88
2201,1472.0,2024-11-06 00:00:00,101.89
2202,1908.0,2024-11-06 00:00:00,73.57
2203,1244.0,2024-11-06 00:00:00,456.43
2204,1256.0,2024-11-06 00:00:00,157.39
2205,2100.0,2024-11-06 00:00:00,262.03
2206,376.0,2024-11-06 00:00:00,15.51
2207,2407.0,2024-11-06 00:00:00,125.54
2208,1945.0,2024-11-06 00:00:00,241.08
2209,1894.0,2024-11-06 00:00:00,162.6
2210,1653.0,2024-11-06 00:00:00,150.88
2211,600.0,2024-11-06 00:00:00,515.69
2212,1293.0,2024-11-06 00:00:00,290.94
2213,118.0,2024-11-06 00:00:00,72.2
2214,2164.0,2024-11-07 00:00:00,225.19
2215,1099.0,2024-11-07 00:00:00,533.7
2216,2055.0,2024-11-07 00:00:00,121.09
2217,2571.0,2024-11-07 00:00:00,92.41
2218,2025.0,2024-11-07 00:00:00,57.77
2219,791.0,2024-11-07 00:00:00,76.54
2220,747.0,2024-11-07 00:00:00,696.84
2221,538.0,2024-11-07 00:00:00,338.31
2222,1491.0,2024-11-07 00:00:00,15.97
2223,2830.0,2024-11-07 00:00:00,35.33
2224,798.0,2024-11-07 00:00:00,138.35
2225,720.0,2024-11-07 00:00:00,24.24
2226,2548.0,2024-11-07 00:00:00,102.4
2227,2127.0,2024-11-07 00:00:00,120.33
2228,947.0,2024-11-07 00:00:00,10.0
2229,507.0,2024-11-07 00:00:00,215.58
2230,2624.0,2024-11-07 00:00:00,122.29
2231,506.0,2024-11-07 00:00:00,12.68
2232,2265.0,2024-11-07 00:00:00,564.37
2233,1873.0,2024-11-07 00:00:00,618.3
2234,1193.0,2024-11-07 00:00:00,39.82
2235,1465.0,2024-11-07 00:00:00,184.16
2236,381.0,2024-11-07 00:00:00,23.58
2237,2011.0,2024-11-07 00:00:00,82.52
2238,2561.0,2024-11-08 00:00:00,35.48
2239,1212.0,2024-11-08 00:00:00,35.51
2240,913.0,2024-11-08 00:00:00,193.5
2241,502.0,2024-11-08 00:00:00,12.07
2242,2119.0,2024-11-08 00:00:00,180.89
2243,457.0,2024-11-08 00:00:00,20.76
2244,920.0,2024-11-08 00:00:00,324.92
2245,1970.0,2024-11-08 00:00:00,150.99
2246,1835.0,2024-11-08 00:00:00,166.87
2247,1870.0,2024-11-08 00:00:00,32.12
2248,1180.0,2024-11-08 00:00:00,70.29
2249,2576.0,2024-11-08 00:00:00,163.45
2250,2308.0,2024-11-08 00:00:00,190.59
2251,304.0,2024-11-08 00:00:00,76.87
2252,2590.0,2024-11-08 00:00:00,16.72
2253,1090.0,2024-11-08 00:00:00,198.9
2254,2270.0,2024-11-08 00:00:00,89.19
2255,693.0,08/11/2024 00:00:00,43.43
2256,2301.0,2024-11-08 00:00:00,26.56
2257,442.0,2024-11-08 00:00:00,880.44
2258,1114.0,2024-11-08 00:00:00,39.0
2259,582.0,2024-11-08 00:00:00,184.93
2260,2646.0,2024-11-08 00:00:00,126.79
2261,2655.0,2024-11-08 00:00:00,1086.96
2262,1566.0,2024-11-08 00:00:00,223.1
2263,2081.0,08/11/2024 00:00:00,32.3
2264,1548.0,2024-11-08 00:00:00,601.29
2265,155.0,2024-11-09 00:00:00,83.66
2266,1270.0,2024-11-09 00:00:00,18.01
2267,1783.0,2024-11-09 00:00:00,51.42
2268,747.0,2024-11-09 00:00:00,28.35
2269,271.0,2024-11-09 00:00:00,188.52
2270,1511.0,2024-11-09 00:00:00,95.91
2271,274.0,2024-11-09 00:00:00,182.99
2272,1707.0,2024-11-09 00:00:00,122.99
2273,422.0,2024-11-09 00:00:00,48.75
2274,2412.0,2024-11-09 00:00:00,10.0
2275,2426.0,2024-11-09 00:00:00,116.38
2276,891.0,2024-11-09 00:00:00,177.35
2277,881.0,2024-11-09 00:00:00,140.05
2278,2008.0,2024-11-09 00:00:00,161.8
2279,383.0,2024-11-09 00:00:00,199.64
2280,2551.0,2024-11-09 00:00:00,182.54
2281,1591.0,2024-11-09 00:00:00,56.84
2282,1887.0,2024-11-09 00:00:00,155.79
2283,1436.0,2024-11-09 00:00:00,107.27
2284,179.0,2024-11-09 00:00:00,196.51
2285,265.0,2024-11-09 00:00:00,10.0
2286,2464.0,2024-11-09 00:00:00,348.43
2287,2245.0,2024-11-09 00:00:00,288.52
2288,480.0,2024-11-09 00:00:00,363.09
2289,890.0,2024-11-09 00:00:00,16.7
2290,925.0,2024-11-09 00:00:00,10.0
2291,1411.0,2024-11-09 00:00:00,40.78
2292,2396.0,2024-11-09 00:00:00,55.99
2293,35.0,2024-11-10 00:00:00,10.5
2294,2671.0,2024-11-10 00:00:00,385.94
2295,904.0,2024-11-10 00:00:00,63.11
2296,2170.0,2024-11-10 00:00:00,31.41
2297,1924.0,10/11/2024 00:00:00,10.0
2298,451.0,2024-11-10 00:00:00,14.76
2299,1357.0,2024-11-10 00:00:00,1043.61
2300,2057.0,2024-11-10 00:00:00,163.23
2301,1017.0,2024-11-10 00:00:00,499.1
2302,839.0,2024-11-10 00:00:00,10.0
2303,1814.0,2024-11-10 00:00:00,155.86
2304,2021.0,2024-11-10 00:00:00,120.0
2305,2314.0,2024-11-10 00:00:00,583.65
2306,1646.0,2024-11-10 00:00:00,121.13
2307,306.0,2024-11-10 00:00:00,37.24
2308,1724.0,2024-11-10 00:00:00,26.31
2309,1392.0,2024-11-10 00:00:00,228.24
2310,420.0,2024-11-10 00:00:00,88.68
2311,2219.0,2024-11-10 00:00:00,234.71
2312,1451.0,2024-11-10 00:00:00,10.0
2313,1165.0,2024-11-10 00:00:00,19.11
2314,1820.0,2024-11-10 00:00:00,15.97
2315,1343.0,2024-11-10 00:00:00,222.0
2316,2227.0,2024-11-10 00:00:00,80.44
2317,1696.0,2024-11-10 00:00:00,134.53
2318,2280.0,2024-11-10 00:00:00,211.67
2319,2780.0,2024-11-10 00:00:00,81.71
2320,814.0,2024-11-10 00:00:00,893.78
2321,2032.0,2024-11-10 00:00:00,628.01
2322,904.0,2024-11-10 00:00:00,159.64
2323,1816.0,2024-11-11 00:00:00,75.77
2324,2654.0,2024-11-11 00:00:00,134.83
2325,148.0,2024-11-11 00:00:00,39.45
2326,367.0,2024-11-11 00:00:00,46.58
2327,2039.0,2024-11-11 00:00:00,23.84
2328,175.0,2024-11-11 00:00:00,511.33
2329,495.0,2024-11-11 00:00:00,114.91
2330,1785.0,2024-11-11 00:00:00,208.52
2331,1171.0,2024-11-11 00:00:00,978.96
2332,1333.0,2024-11-11 00:00:00,232.5
2333,1038.0,2024-11-11 00:00:00,355.13
2334,1452.0,2024-11-11 00:00:00,134.62
2335,705.0,2024-11-11 00:00:00,105.42
2336,2935.0,2024-11-11 00:00:00,189.49
2337,1874.0,2024-11-11 00:00:00,332.64
2338,1884.0,2024-11-11 00:00:00,263.03
2339,1313.0,11/11/2024 00:00:00,357.49
2340,2939.0,2024-11-11 00:00:00,14.08
2341,1201.0,2024-11-11 00:00:00,630.23
2342,1635.0,2024-11-11 00:00:00,30.16
2343,1507.0,2024-11-11 00:00:00,123.11
2344,294.0,2024-11-11 00:00:00,103.08
2345,1367.0,2024-11-11 00:00:00,168.12
2346,2710.0,2024-11-12 00:00:00,29.06
2347,419.0,2024-11-12 00:00:00,100.84
2348,2888.0,2024-11-12 00:00:00,34.57
2349,2262.0,2024-11-12 00:00:00,423.39
2350,1768.0,2024-11-12 00:00:00,27.29
2351,2113.0,2024-11-12 00:00:00,87.51
2352,627.0,2024-11-12 00:00:00,221.26
2353,2987.0,2024-11-12 00:00:00,241.28
2354,1376.0,2024-11-12 00:00:00,88.57
2355,491.0,2024-11-12 00:00:00,86.11
2356,1941.0,2024-11-12 00:00:00,127.63
2357,919.0,2024-11-12 00:00:00,75.67
2358,2988.0,2024-11-12 00:00:00,47.17
2359,1327.0,2024-11-12 00:00:00,10.0
2360,682.0,2024-11-12 00:00:00,128.12
2361,1456.0,2024-11-13 00:00:00,165.97
2362,2694.0,2024-11-13 00:00:00,80.26
2363,245.0,2024-11-13 00:00:00,167.58
2364,2581.0,2024-11-13 00:00:00,265.62
2365,2160.0,2024-11-13 00:00:00,27.97
2366,2391.0,2024-11-13 00:00:00,76.34
2367,2677.0,2024-11-13 00:00:00,12.57
2368,28.0,2024-11-13 00:00:00,144.19
2369,1561.0,2024-11-13 00:00:00,76.85
2370,297.0,2024-11-13 00:00:00,137.13
2371,2297.0,2024-11-13 00:00:00,55.57
2372,902.0,13/11/2024 00:00:00,10.0
2373,1678.0,2024-11-13 00:00:00,22.11
2374,771.0,13/11/2024 00:00:00,38.33
2375,1379.0,2024-11-13 00:00:00,12.57
2376,1555.0,2024-11-13 00:00:00,196.53
2377,1265.0,2024-11-13 00:00:00,89.77
2378,2392.0,2024-11-13 00:00:00,147.37
2379,2750.0,2024-11-13 00:00:00,205.49
2380,153.0,2024-11-13 00:00:00,10.0
2381,508.0,2024-11-13 00:00:00,25.95
2382,345.0,2024-11-13 00:00:00,75.98
2383,221.0,2024-11-13 00:00:00,332.32
2384,723.0,2024-11-14 00:00:00,189.17
2385,1523.0,2024-11-14 00:00:00,59.07
2386,481.0,2024-11-14 00:00:00,62.61
2387,2920.0,2024-11-14 00:00:00,56.7
2388,345.0,2024-11-14 00:00:00,162.0
2389,2069.0,2024-11-14 00:00:00,111.2
2390,1888.0,2024-11-14 00:00:00,356.21
2391,1515.0,2024-11-14 00:00:00,18.38
2392,1002.0,2024-11-14 00:00:00,296.27
2393,2041.0,2024-11-14 00:00:00,48.16
2394,956.0,2024-11-14 00:00:00,10.0
2395,381.0,2024-11-14 00:00:00,334.12
2396,2063.0,2024-11-14 00:00:00,98.03
2397,1192.0,14/11/2024 00:00:00,221.05
2398,1161.0,2024-11-14 00:00:00,69.5
2399,272.0,2024-11-14 00:00:00,80.93
2400,1913.0,2024-11-15 00:00:00,434.61
2401,2295.0,2024-11-15 00:00:00,217.28
2402,2127.0,2024-11-15 00:00:00,217.55
2403,2573.0,2024-11-15 00:00:00,10.0
2404,1119.0,2024-11-15 00:00:00,28.53
2405,67.0,2024-11-15 00:00:00,10.09
2406,2816.0,2024-11-15 00:00:00,455.36
2407,1141.0,2024-11-15 00:00:00,10.0
2408,2533.0,2024-11-15 00:00:00,29.73
2409,1188.0,2024-11-15 00:00:00,138.65
2410,549.0,2024-11-15 00:00:00,54.64
2411,73.0,2024-11-15 00:00:00,285.43
2412,1782.0,2024-11-15 00:00:00,105.76
2413,791.0,2024-11-15 00:00:00,193.71
2414,1856.0,2024-11-15 00:00:00,207.47
2415,1175.0,2024-11-16 00:00:00,97.53
2416,179.0,2024-11-16 00:00:00,434.82
2417,735.0,2024-11-16 00:00:00,235.31
2418,788.0,2024-11-16 00:00:00,100.03
2419,209.0,2024-11-16 00:00:00,40.29
2420,2713.0,2024-11-16 00:00:00,261.36
2421,2919.0,2024-11-16 00:00:00,199.94
2422,1606.0,2024-11-16 00:00:00,91.44
2423,594.0,2024-11-16 00:00:00,46.28
2424,2900.0,2024-11-16 00:00:00,273.47
2425,979.0,2024-11-16 00:00:00,101.59
2426,1491.0,2024-11-16 00:00:00,148.22
2427,144.0,2024-11-16 00:00:00,334.35
2428,2372.0,2024-11-16 00:00:00,317.01
2429,1516.0,2024-11-16 00:00:00,454.6
2430,2231.0,2024-11-16 00:00:00,30.9
2431,1491.0,2024-11-16 00:00:00,626.04
2432,2515.0,2024-11-16 00:00:00,310.21
2433,1168.0,2024-11-16 00:00:00,133.17
2434,232.0,2024-11-16 00:00:00,334.68
2435,1756.0,2024-11-16 00:00:00,183.24
2436,2643.0,2024-11-16 00:00:00,416.67
2437,2221.0,2024-11-16 00:00:00,391.37
2438,2594.0,2024-11-16 00:00:00,63.96
2439,518.0,2024-11-16 00:00:00,234.44
2440,2263.0,2024-11-16 00:00:00,383.91
2441,1945.0,2024-11-16 00:00:00,11.05
2442,2734.0,2024-11-16 00:00:00,207.54
2443,2942.0,2024-11-16 00:00:00,74.81
2444,899.0,2024-11-17 00:00:00,38.99
2445,1213.0,2024-11-17 00:00:00,29.54
2446,688.0,2024-11-17 00:00:00,79.74
2447,1208.0,2024-11-17 00:00:00,53.74
2448,827.0,2024-11-17 00:00:00,334.21
2449,1812.0,2024-11-17 00:00:00,68.34
2450,1083.0,2024-11-17 00:00:00,325.16
2451,1645.0,17/11/2024 00:00:00,244.18
2452,191.0,2024-11-17 00:00:00,17.1
2453,708.0,2024-11-17 00:00:00,196.16
2454,387.0,2024-11-17 00:00:00,36.99
2455,616.0,2024-11-17 00:00:00,392.77
2456,2049.0,2024-11-17 00:00:00,129.05
2457,967.0,2024-11-17 00:00:00,96.71
2458,1147.0,2024-11-17 00:00:00,362.12
2459,1909.0,2024-11-17 00:00:00,202.15
2460,2623.0,2024-11-17 00:00:00,254.87
2461,2025.0,17/11/2024 00:00:00,73.6
2462,2257.0,2024-11-17 00:00:00,123.57
2463,1413.0,2024-11-17 00:00:00,795.22
2464,2051.0,2024-11-17 00:00:00,247.15
2465,1470.0,2024-11-17 00:00:00,102.91
2466,447.0,17/11/2024 00:00:00,244.59
2467,1341.0,2024-11-17 00:00:00,90.19
2468,1809.0,2024-11-17 00:00:00,72.55
2469,2711.0,2024-11-17 00:00:00,189.35
2470,718.0,2024-11-17 00:00:00,78.94
2471,1606.0,2024-11-18 00:00:00,86.09
2472,562.0,2024-11-18 00:00:00,199.6
2473,387.0,2024-11-18 00:00:00,198.65
2474,973.0,18/11/2024 00:00:00,70.84
2475,984.0,2024-11-18 00:00:00,759.65
2476,1725.0,2024-11-18 00:00:00,29.99
2477,1908.0,2024-11-18 00:00:00,157.17
2478,1025.0,2024-11-18 00:00:00,11.56
2479,79.0,2024-11-18 00:00:00,88.38
2480,889.0,2024-11-18 00:00:00,37.65
2481,1106.0,2024-11-18 00:00:00,116.2
2482,1501.0,2024-11-18 00:00:00,10.0
2483,2813.0,2024-11-18 00:00:00,107.52
2484,2062.0,2024-11-18 00:00:00,811.87
2485,2358.0,2024-11-18 00:00:00,128.49
2486,1381.0,2024-11-18 00:00:00,217.62
2487,340.0,2024-11-18 00:00:00,109.7
2488,757.0,2024-11-18 00:00:00,340.34
2489,2354.0,2024-11-18 00:00:00,209.25
2490,2673.0,2024-11-18 00:00:00,29.55
2491,848.0,2024-11-18 00:00:00,59.32
2492,130.0,2024-11-18 00:00:00,534.22
2493,1959.0,2024-11-18 00:00:00,77.38
2494,2641.0,2024-11-19 00:00:00,1091.44
2495,2373.0,2024-11-19 00:00:00,60.11
2496,2496.0,2024-11-19 00:00:00,84.63
2497,1641.0,2024-11-19 00:00:00,169.15
2498,1737.0,2024-11-19 00:00:00,108.5
2499,1858.0,2024-11-19 00:00:00,10.0
2500,2660.0,2024-11-19 00:00:00,143.89
2501,2722.0,2024-11-19 00:00:00,36.74
2502,1446.0,2024-11-19 00:00:00,264.0
2503,1633.0,2024-11-19 00:00:00,257.49
2504,895.0,2024-11-19 00:00:00,112.61
2505,216.0,2024-11-19 00:00:00,73.55
2506,2173.0,2024-11-19 00:00:00,85.8
2507,1707.0,2024-11-19 00:00:00,272.54
2508,2209.0,2024-11-19 00:00:00,253.68
2509,1129.0,2024-11-19 00:00:00,276.76
2510,2366.0,19/11/2024 00:00:00,52.98
2511,1623.0,2024-11-19 00:00:00,277.47
2512,472.0,2024-11-19 00:00:00,10.0
2513,2061.0,2024-11-19 00:00:00,16.93
2514,2742.0,2024-11-19 00:00:00,83.48
2515,229.0,2024-11-19 00:00:00,232.0
2516,189.0,2024-11-19 00:00:00,142.22
2517,1103.0,2024-11-19 00:00:00,296.72
2518,499.0,2024-11-19 00:00:00,10.0
2519,866.0,2024-11-19 00:00:00,123.51
2520,1859.0,2024-11-20 00:00:00,330.12
2521,146.0,2024-11-20 00:00:00,866.97
2522,1320.0,2024-11-20 00:00:00,65.55
2523,193.0,2024-11-20 00:00:00,435.19
2524,52.0,2024-11-20 00:00:00,397.44
2525,1821.0,2024-11-20 00:00:00,245.09
2526,1870.0,2024-11-20 00:00:00,391.46
2527,1455.0,2024-11-20 00:00:00,103.33
2528,2739.0,2024-11-20 00:00:00,10.0
2529,2580.0,2024-11-20 00:00:00,351.5
2530,840.0,2024-11-20 00:00:00,73.58
2531,241.0,2024-11-20 00:00:00,29.47
2532,1408.0,2024-11-20 00:00:00,14.12
2533,83.0,2024-11-20 00:00:00,111.78
2534,951.0,2024-11-20 00:00:00,50.7
2535,574.0,2024-11-21 00:00:00,94.6
2536,459.0,2024-11-21 00:00:00,471.41
2537,1523.0,2024-11-21 00:00:00,80.14
2538,2658.0,2024-11-21 00:00:00,366.51
2539,2160.0,2024-11-21 00:00:00,246.82
2540,122.0,2024-11-21 00:00:00,70.78
2541,398.0,2024-11-21 00:00:00,224.18
2542,1231.0,2024-11-21 00:00:00,305.72
2543,1302.0,2024-11-21 00:00:00,253.12
2544,1911.0,2024-11-21 00:00:00,26.44
2545,1506.0,2024-11-21 00:00:00,480.33
2546,1917.0,2024-11-21 00:00:00,10.0
2547,2901.0,2024-11-21 00:00:00,157.33
2548,1957.0,2024-11-21 00:00:00,37.72
2549,897.0,2024-11-21 00:00:00,56.73
2550,1973.0,2024-11-21 00:00:00,29.93
2551,61.0,21/11/2024 00:00:00,131.88
2552,2586.0,2024-11-21 00:00:00,143.4
2553,65.0,2024-11-21 00:00:00,362.09
2554,1728.0,2024-11-21 00:00:00,479.82
2555,535.0,2024-11-21 00:00:00,790.5
2556,2741.0,2024-11-21 00:00:00,66.87
2557,1871.0,2024-11-21 00:00:00,421.43
2558,1005.0,2024-11-21 00:00:00,99.95
2559,2638.0,2024-11-21 00:00:00,117.92
2560,608.0,2024-11-21 00:00:00,235.04
2561,1034.0,21/11/2024 00:00:00,43.2
2562,1105.0,2024-11-21 00:00:00,139.97
2563,1862.0,2024-11-21 00:00:00,212.68
2564,2921.0,2024-11-22 00:00:00,207.43
2565,438.0,2024-11-22 00:00:00,25.16
2566,1222.0,2024-11-22 00:00:00,315.13
2567,902.0,22/11/2024 00:00:00,106.72
2568,1303.0,2024-11-22 00:00:00,602.45
2569,2509.0,2024-11-22 00:00:00,623.13
2570,1068.0,2024-11-22 00:00:00,698.77
2571,548.0,2024-11-22 00:00:00,39.47
2572,704.0,2024-11-22 00:00:00,24.62
2573,1591.0,2024-11-22 00:00:00,353.39
2574,848.0,2024-11-22 00:00:00,795.39
2575,1358.0,2024-11-22 00:00:00,130.08
2576,2127.0,2024-11-22 00:00:00,198.08
2577,2461.0,2024-11-22 00:00:00,31.57
2578,2217.0,22/11/2024 00:00:00,151.48
2579,2631.0,2024-11-22 00:00:00,436.91
2580,2080.0,2024-11-22 00:00:00,238.52
2581,1927.0,2024-11-22 00:00:00,343.32
2582,2318.0,2024-11-22 00:00:00,222.59
2583,2566.0,2024-11-22 00:00:00,88.0
2584,2631.0,2024-11-22 00:00:00,348.37
2585,670.0,2024-11-23 00:00:00,336.81
2586,2174.0,2024-11-23 00:00:00,55.37
2587,2122.0,2024-11-23 00:00:00,686.8
2588,1706.0,2024-11-23 00:00:00,166.2
2589,56.0,2024-11-23 00:00:00,176.63
2590,2080.0,2024-11-23 00:00:00,90.04
2591,667.0,2024-11-23 00:00:00,-13.86
2592,2235.0,2024-11-23 00:00:00,322.83
2593,130.0,2024-11-23 00:00:00,95.04
2594,2162.0,2024-11-23 00:00:00,430.29
2595,2492.0,2024-11-23 00:00:00,10.0
2596,2495.0,23/11/2024 00:00:00,171.5
2597,2763.0,2024-11-23 00:00:00,11.47
2598,101.0,2024-11-23 00:00:00,89.38
2599,41.0,2024-11-23 00:00:00,16.8
2600,366.0,2024-11-23 00:00:00,70.76
2601,2705.0,2024-11-23 00:00:00,52.69
2602,825.0,2024-11-23 00:00:00,10.0
2603,889.0,23/11/2024 00:00:00,56.35
2604,2884.0,2024-11-24 00:00:00,520.9
2605,117.0,2024-11-24 00:00:00,168.98
2606,1118.0,2024-11-24 00:00:00,46.08
2607,1739.0,24/11/2024 00:00:00,54.95
2608,695.0,2024-11-24 00:00:00,66.36
2609,586.0,2024-11-24 00:00:00,152.95
2610,2322.0,2024-11-24 00:00:00,261.03
2611,2149.0,2024-11-24 00:00:00,182.94
2612,1553.0,2024-11-24 00:00:00,93.07
2613,157.0,2024-11-24 00:00:00,82.75
2614,1428.0,2024-11-24 00:00:00,175.0
2615,559.0,2024-11-24 00:00:00,425.55
2616,2313.0,2024-11-24 00:00:00,75.39
2617,155.0,24/11/2024 00:00:00,125.11
2618,997.0,2024-11-24 00:00:00,412.13
2619,2906.0,24/11/2024 00:00:00,503.18
2620,729.0,2024-11-24 00:00:00,235.15
2621,92.0,2024-11-24 00:00:00,195.76
2622,1504.0,2024-11-24 00:00:00,134.3
2623,2498.0,2024-11-24 00:00:00,498.32
2624,787.0,2024-11-24 00:00:00,168.31
2625,2636.0,2024-11-24 00:00:00,334.06
2626,2879.0,2024-11-24 00:00:00,258.28
2627,567.0,2024-11-24 00:00:00,357.88
2628,1332.0,2024-11-24 00:00:00,313.36
2629,1799.0,2024-11-24 00:00:00,82.87
2630,2916.0,2024-11-24 00:00:00,327.05
2631,1213.0,2024-11-24 00:00:00,273.16
2632,1153.0,24/11/2024 00:00:00,10.52
2633,1142.0,2024-11-24 00:00:00,224.02
2634,2490.0,2024-11-25 00:00:00,175.14
2635,487.0,2024-11-25 00:00:00,88.32
2636,1936.0,2024-11-25 00:00:00,130.9
2637,1358.0,2024-11-25 00:00:00,157.8
2638,90.0,2024-11-25 00:00:00,181.48
2639,538.0,2024-11-25 00:00:00,10.0
2640,724.0,25/11/2024 00:00:00,48.68
2641,1460.0,2024-11-25 00:00:00,151.58
2642,2507.0,2024-11-25 00:00:00,189.94
2643,620.0,2024-11-25 00:00:00,128.91
2644,1164.0,2024-11-25 00:00:00,654.57
2645,1953.0,2024-11-25 00:00:00,245.71
2646,1752.0,2024-11-25 00:00:00,228.31
2647,2796.0,25/11/2024 00:00:00,26.35
2648,2972.0,2024-11-25 00:00:00,111.99
2649,1960.0,2024-11-25 00:00:00,10.0
2650,1481.0,2024-11-25 00:00:00,88.62
2651,2839.0,2024-11-25 00:00:00,98.11
2652,2352.0,2024-11-25 00:00:00,160.0
2653,2644.0,2024-11-25 00:00:00,388.93
